15:41:02.688982 IP 10.1.1.127.22 > 10.1.1.134.39280: Flags [P.], seq 4123807318:4123807514, ack 4047459598, win 393, options [nop,nop,TS val 472677060 ecr 2911787], length 196
15:41:02.689856 IP 10.1.1.134.39280 > 10.1.1.127.22: Flags [.], ack 196, win 16885, options [nop,nop,TS val 2911802 ecr 472677060], length 0
15:41:02.696049 IP 10.1.1.127.50000 > 10.1.1.134.53854: Flags [.], seq 2596278162:2596279610, ack 3459391399, win 64, options [nop,nop,TS val 472677062 ecr 2911799], length 1448
15:41:02.715701 IP 10.1.1.134.53854 > 10.1.1.127.50000: Flags [.], ack 1448, win 39680, options [nop,nop,TS val 2911809 ecr 472677056], length 0
15:41:02.715721 IP 10.1.1.127.50000 > 10.1.1.134.53854: Flags [.], seq 1448:4344, ack 1, win 64, options [nop,nop,TS val 472677066 ecr 2911809], length 2896
15:41:02.715730 IP 10.1.1.127.50000 > 10.1.1.134.53854: Flags [.], seq 4344:7240, ack 1, win 64, options [nop,nop,TS val 472677066 ecr 2911809], length 2896
15:41:02.715819 IP 10.1.1.127.50000 > 10.1.1.134.53854: Flags [P.], seq 7240:8688, ack 1, win 64, options [nop,nop,TS val 472677066 ecr 2911809], length 1448
15:41:02.744018 IP 10.1.1.127.50000 > 10.1.1.134.53854: Flags [P.], seq 7240:8688, ack 1, win 64, options [nop,nop,TS val 472677074 ecr 2911809], length 1448
15:41:02.744864 IP 10.1.1.134.53854 > 10.1.1.127.50000: Flags [.], ack 8688, win 38480, options [nop,nop,TS val 2911816 ecr 472677066,nop,nop,sack 1 {7240:8688}], length 0
15:41:02.744915 IP 10.1.1.127.50000 > 10.1.1.134.53854: Flags [.], seq 8688:11584, ack 1, win 64, options [nop,nop,TS val 472677074 ecr 2911816], length 2896
15:41:02.744923 IP 10.1.1.127.50000 > 10.1.1.134.53854: Flags [.], seq 11584:14480, ack 1, win 64, options [nop,nop,TS val 472677074 ecr 2911816], length 2896
15:41:02.744928 IP 10.1.1.127.50000 > 10.1.1.134.53854: Flags [.], seq 14480:17376, ack 1, win 64, options [nop,nop,TS val 472677074 ecr 2911816], length 2896
15:41:02.745006 IP 10.1.1.127.50000 > 10.1.1.134.53854: Flags [.], seq 17376:20272, ack 1, win 64, options [nop,nop,TS val 472677074 ecr 2911816], length 2896
15:41:02.745015 IP 10.1.1.127.50000 > 10.1.1.134.53854: Flags [.], seq 20272:23168, ack 1, win 64, options [nop,nop,TS val 472677074 ecr 2911816], length 2896
15:41:02.745068 IP 10.1.1.127.50000 > 10.1.1.134.53854: Flags [.], ack 1, win 15040, options [nop,nop,TS val 472677074 ecr 2911816], length 0
15:41:02.745822 IP 10.1.1.134.53854 > 10.1.1.127.50000: Flags [.], ack 10136, win 38240, options [nop,nop,TS val 2911816 ecr 472677074], length 0
15:41:02.745838 IP 10.1.1.134.53854 > 10.1.1.127.50000: Flags [.], ack 11584, win 38000, options [nop,nop,TS val 2911816 ecr 472677074], length 0
15:41:02.745845 IP 10.1.1.134.53854 > 10.1.1.127.50000: Flags [.], ack 13032, win 37760, options [nop,nop,TS val 2911816 ecr 472677074], length 0
15:41:02.746080 IP 10.1.1.134.53854 > 10.1.1.127.50000: Flags [.], ack 14480, win 37520, options [nop,nop,TS val 2911816 ecr 472677074], length 0
15:41:02.746096 IP 10.1.1.127.50000 > 10.1.1.134.53854: Flags [.], seq 23168:26064, ack 1, win 15040, options [nop,nop,TS val 472677074 ecr 2911816], length 2896
15:41:02.746242 IP 10.1.1.134.53854 > 10.1.1.127.50000: Flags [.], ack 15928, win 37280, options [nop,nop,TS val 2911816 ecr 472677074], length 0
15:41:02.746257 IP 10.1.1.134.53854 > 10.1.1.127.50000: Flags [.], ack 17376, win 37040, options [nop,nop,TS val 2911816 ecr 472677074], length 0
15:41:02.746266 IP 10.1.1.127.50000 > 10.1.1.134.53854: Flags [.], seq 26064:28960, ack 1, win 15040, options [nop,nop,TS val 472677074 ecr 2911816], length 2896
15:41:02.746425 IP 10.1.1.134.53854 > 10.1.1.127.50000: Flags [.], ack 18824, win 36800, options [nop,nop,TS val 2911816 ecr 472677074], length 0
15:41:02.746439 IP 10.1.1.134.53854 > 10.1.1.127.50000: Flags [.], ack 20272, win 36560, options [nop,nop,TS val 2911816 ecr 472677074], length 0
15:41:02.746448 IP 10.1.1.127.50000 > 10.1.1.134.53854: Flags [.], seq 28960:31856, ack 1, win 15040, options [nop,nop,TS val 472677074 ecr 2911816], length 2896
15:41:02.746602 IP 10.1.1.134.53854 > 10.1.1.127.50000: Flags [.], ack 21720, win 36320, options [nop,nop,TS val 2911816 ecr 472677074], length 0
15:41:02.746758 IP 10.1.1.134.53854 > 10.1.1.127.50000: Flags [.], ack 23168, win 36080, options [nop,nop,TS val 2911816 ecr 472677074], length 0
15:41:02.746768 IP 10.1.1.127.50000 > 10.1.1.134.53854: Flags [.], seq 31856:36200, ack 1, win 15040, options [nop,nop,TS val 472677074 ecr 2911816], length 4344
15:41:02.746953 IP 10.1.1.134.53854 > 10.1.1.127.50000: Flags [.], seq 1:1449, ack 23168, win 36080, options [nop,nop,TS val 2911816 ecr 472677074], length 1448
15:41:02.747109 IP 10.1.1.134.53854 > 10.1.1.127.50000: Flags [.], seq 1449:2897, ack 23168, win 36080, options [nop,nop,TS val 2911816 ecr 472677074], length 1448
15:41:02.747290 IP 10.1.1.134.53854 > 10.1.1.127.50000: Flags [.], seq 2897:4345, ack 23168, win 36080, options [nop,nop,TS val 2911816 ecr 472677074], length 1448
15:41:02.747401 IP 10.1.1.134.53854 > 10.1.1.127.50000: Flags [.], seq 4345:5793, ack 23168, win 36080, options [nop,nop,TS val 2911816 ecr 472677074], length 1448
15:41:02.747507 IP 10.1.1.134.53854 > 10.1.1.127.50000: Flags [P.], seq 5793:7241, ack 23168, win 36080, options [nop,nop,TS val 2911816 ecr 472677074], length 1448
15:41:02.747641 IP 10.1.1.134.53854 > 10.1.1.127.50000: Flags [.], seq 7241:8689, ack 23168, win 36080, options [nop,nop,TS val 2911816 ecr 472677074], length 1448
15:41:02.747772 IP 10.1.1.134.53854 > 10.1.1.127.50000: Flags [.], seq 8689:10137, ack 23168, win 36080, options [nop,nop,TS val 2911816 ecr 472677074], length 1448
15:41:02.747893 IP 10.1.1.134.53854 > 10.1.1.127.50000: Flags [.], seq 10137:11585, ack 23168, win 36080, options [nop,nop,TS val 2911816 ecr 472677074], length 1448
15:41:02.747999 IP 10.1.1.134.53854 > 10.1.1.127.50000: Flags [.], seq 11585:13033, ack 23168, win 36080, options [nop,nop,TS val 2911816 ecr 472677074], length 1448
15:41:02.748097 IP 10.1.1.134.53854 > 10.1.1.127.50000: Flags [.], seq 13033:14481, ack 23168, win 36080, options [nop,nop,TS val 2911816 ecr 472677074], length 1448
15:41:02.748223 IP 10.1.1.134.53854 > 10.1.1.127.50000: Flags [.], seq 14481:15929, ack 23168, win 36080, options [nop,nop,TS val 2911816 ecr 472677074], length 1448
15:41:02.748342 IP 10.1.1.134.53854 > 10.1.1.127.50000: Flags [.], seq 15929:17377, ack 23168, win 36080, options [nop,nop,TS val 2911816 ecr 472677074], length 1448
15:41:02.748452 IP 10.1.1.134.53854 > 10.1.1.127.50000: Flags [P.], seq 17377:18825, ack 23168, win 36080, options [nop,nop,TS val 2911816 ecr 472677074], length 1448
15:41:02.748589 IP 10.1.1.134.53854 > 10.1.1.127.50000: Flags [.], seq 18825:20273, ack 24616, win 35840, options [nop,nop,TS val 2911816 ecr 472677074], length 1448
15:41:02.748712 IP 10.1.1.134.53854 > 10.1.1.127.50000: Flags [.], seq 20273:21721, ack 24616, win 35840, options [nop,nop,TS val 2911816 ecr 472677074], length 1448
15:41:02.748836 IP 10.1.1.134.53854 > 10.1.1.127.50000: Flags [.], seq 21721:23169, ack 26064, win 35568, options [nop,nop,TS val 2911816 ecr 472677074], length 1448
15:41:02.748976 IP 10.1.1.134.53854 > 10.1.1.127.50000: Flags [.], seq 23169:24617, ack 26064, win 35568, options [nop,nop,TS val 2911816 ecr 472677074], length 1448
15:41:02.749144 IP 10.1.1.134.53854 > 10.1.1.127.50000: Flags [P.], seq 24617:26065, ack 26064, win 35568, options [nop,nop,TS val 2911816 ecr 472677074], length 1448
15:41:02.749250 IP 10.1.1.134.53854 > 10.1.1.127.50000: Flags [.], seq 26065:27513, ack 28960, win 35088, options [nop,nop,TS val 2911816 ecr 472677074], length 1448
15:41:02.749268 IP 10.1.1.127.50000 > 10.1.1.134.53854: Flags [.], seq 36200:40544, ack 27513, win 10448, options [nop,nop,TS val 472677075 ecr 2911816], length 4344
15:41:02.749350 IP 10.1.1.134.53854 > 10.1.1.127.50000: Flags [.], seq 27513:28961, ack 31856, win 34608, options [nop,nop,TS val 2911816 ecr 472677074], length 1448
15:41:02.749369 IP 10.1.1.127.50000 > 10.1.1.134.53854: Flags [.], seq 40544:44888, ack 28961, win 10208, options [nop,nop,TS val 472677075 ecr 2911816], length 4344
15:41:02.749453 IP 10.1.1.134.53854 > 10.1.1.127.50000: Flags [.], seq 28961:30409, ack 31856, win 34608, options [nop,nop,TS val 2911816 ecr 472677074], length 1448
15:41:02.749636 IP 10.1.1.134.53854 > 10.1.1.127.50000: Flags [.], seq 30409:31857, ack 33304, win 34368, options [nop,nop,TS val 2911817 ecr 472677074], length 1448
15:41:02.749746 IP 10.1.1.134.53854 > 10.1.1.127.50000: Flags [.], seq 31857:33305, ack 34752, win 34128, options [nop,nop,TS val 2911817 ecr 472677074], length 1448
15:41:02.749869 IP 10.1.1.134.53854 > 10.1.1.127.50000: Flags [.], seq 33305:34753, ack 36200, win 33888, options [nop,nop,TS val 2911817 ecr 472677074], length 1448
15:41:02.749888 IP 10.1.1.127.50000 > 10.1.1.134.53854: Flags [.], seq 44888:49232, ack 34753, win 9216, options [nop,nop,TS val 472677075 ecr 2911816], length 4344
15:41:02.749962 IP 10.1.1.134.53854 > 10.1.1.127.50000: Flags [.], seq 34753:36201, ack 36200, win 33888, options [nop,nop,TS val 2911817 ecr 472677074], length 1448
15:41:02.750071 IP 10.1.1.134.53854 > 10.1.1.127.50000: Flags [.], seq 36201:37649, ack 36200, win 33888, options [nop,nop,TS val 2911817 ecr 472677074], length 1448
15:41:02.750193 IP 10.1.1.134.53854 > 10.1.1.127.50000: Flags [.], seq 37649:39097, ack 36200, win 33888, options [nop,nop,TS val 2911817 ecr 472677074], length 1448
15:41:02.750317 IP 10.1.1.134.53854 > 10.1.1.127.50000: Flags [.], seq 39097:40545, ack 36200, win 33888, options [nop,nop,TS val 2911817 ecr 472677074], length 1448
15:41:02.750426 IP 10.1.1.134.53854 > 10.1.1.127.50000: Flags [P.], seq 40545:41993, ack 36200, win 33888, options [nop,nop,TS val 2911817 ecr 472677074], length 1448
15:41:02.750563 IP 10.1.1.134.53854 > 10.1.1.127.50000: Flags [.], seq 41993:43441, ack 36200, win 33888, options [nop,nop,TS val 2911817 ecr 472677074], length 1448
15:41:02.750685 IP 10.1.1.134.53854 > 10.1.1.127.50000: Flags [P.], seq 43441:44889, ack 36200, win 33888, options [nop,nop,TS val 2911817 ecr 472677074], length 1448
15:41:02.750810 IP 10.1.1.134.53854 > 10.1.1.127.50000: Flags [P.], seq 44889:46337, ack 36200, win 33888, options [nop,nop,TS val 2911817 ecr 472677074], length 1448
15:41:02.750920 IP 10.1.1.134.53854 > 10.1.1.127.50000: Flags [.], seq 46337:47785, ack 36200, win 33888, options [nop,nop,TS val 2911817 ecr 472677074], length 1448
15:41:02.751124 IP 10.1.1.134.53854 > 10.1.1.127.50000: Flags [.], seq 47785:49233, ack 36200, win 33888, options [nop,nop,TS val 2911817 ecr 472677074], length 1448
15:41:02.751215 IP 10.1.1.134.53854 > 10.1.1.127.50000: Flags [.], seq 49233:50681, ack 36200, win 33888, options [nop,nop,TS val 2911817 ecr 472677074], length 1448
15:41:02.751339 IP 10.1.1.134.53854 > 10.1.1.127.50000: Flags [.], seq 50681:52129, ack 36200, win 33888, options [nop,nop,TS val 2911817 ecr 472677074], length 1448
15:41:02.751443 IP 10.1.1.134.53854 > 10.1.1.127.50000: Flags [.], seq 52129:53577, ack 36200, win 33888, options [nop,nop,TS val 2911817 ecr 472677074], length 1448
15:41:02.751552 IP 10.1.1.134.53854 > 10.1.1.127.50000: Flags [.], seq 53577:55025, ack 36200, win 33888, options [nop,nop,TS val 2911817 ecr 472677074], length 1448
15:41:02.751675 IP 10.1.1.134.53854 > 10.1.1.127.50000: Flags [.], seq 55025:56473, ack 36200, win 33888, options [nop,nop,TS val 2911817 ecr 472677074], length 1448
15:41:02.751796 IP 10.1.1.134.53854 > 10.1.1.127.50000: Flags [.], seq 56473:57921, ack 36200, win 33888, options [nop,nop,TS val 2911817 ecr 472677074], length 1448
15:41:02.751907 IP 10.1.1.134.53854 > 10.1.1.127.50000: Flags [.], seq 57921:59369, ack 37648, win 33648, options [nop,nop,TS val 2911817 ecr 472677075], length 1448
15:41:02.752044 IP 10.1.1.134.53854 > 10.1.1.127.50000: Flags [.], seq 59369:60817, ack 39096, win 33408, options [nop,nop,TS val 2911817 ecr 472677075], length 1448
15:41:02.752166 IP 10.1.1.134.53854 > 10.1.1.127.50000: Flags [.], seq 60817:62265, ack 40544, win 41872, options [nop,nop,TS val 2911817 ecr 472677075], length 1448
15:41:02.752178 IP 10.1.1.127.50000 > 10.1.1.134.53854: Flags [.], seq 49232:53576, ack 62265, win 4624, options [nop,nop,TS val 472677076 ecr 2911817], length 4344
15:41:02.752292 IP 10.1.1.134.53854 > 10.1.1.127.50000: Flags [.], seq 62265:63713, ack 41992, win 41632, options [nop,nop,TS val 2911817 ecr 472677075], length 1448
15:41:02.752430 IP 10.1.1.134.53854 > 10.1.1.127.50000: Flags [.], seq 63713:65161, ack 43440, win 41392, options [nop,nop,TS val 2911817 ecr 472677075], length 1448
15:41:02.752538 IP 10.1.1.134.53854 > 10.1.1.127.50000: Flags [.], seq 65161:66609, ack 43440, win 41392, options [nop,nop,TS val 2911817 ecr 472677075], length 1448
15:41:02.752661 IP 10.1.1.134.53854 > 10.1.1.127.50000: Flags [.], seq 66609:68057, ack 46336, win 40912, options [nop,nop,TS val 2911817 ecr 472677075], length 1448
15:41:02.752677 IP 10.1.1.127.50000 > 10.1.1.134.53854: Flags [.], seq 53576:59368, ack 68057, win 3664, options [nop,nop,TS val 472677076 ecr 2911817], length 5792
15:41:02.752782 IP 10.1.1.134.53854 > 10.1.1.127.50000: Flags [.], seq 68057:69505, ack 47784, win 40672, options [nop,nop,TS val 2911817 ecr 472677075], length 1448
15:41:02.752894 IP 10.1.1.134.53854 > 10.1.1.127.50000: Flags [.], seq 69505:70953, ack 49232, win 40432, options [nop,nop,TS val 2911817 ecr 472677075], length 1448
15:41:02.753164 IP 10.1.1.134.53854 > 10.1.1.127.50000: Flags [.], seq 70953:72401, ack 50680, win 40192, options [nop,nop,TS val 2911818 ecr 472677076], length 1448
15:41:02.753177 IP 10.1.1.127.50000 > 10.1.1.134.53854: Flags [.], seq 59368:63712, ack 72401, win 2578, options [nop,nop,TS val 472677076 ecr 2911817], length 4344
15:41:02.753291 IP 10.1.1.134.53854 > 10.1.1.127.50000: Flags [P.], seq 72401:73849, ack 50680, win 40192, options [nop,nop,TS val 2911818 ecr 472677076], length 1448
15:41:02.753412 IP 10.1.1.134.53854 > 10.1.1.127.50000: Flags [.], seq 73849:75297, ack 50680, win 40192, options [nop,nop,TS val 2911818 ecr 472677076], length 1448
15:41:02.753522 IP 10.1.1.134.53854 > 10.1.1.127.50000: Flags [.], seq 75297:76745, ack 50680, win 40192, options [nop,nop,TS val 2911818 ecr 472677076], length 1448
15:41:02.753658 IP 10.1.1.134.53854 > 10.1.1.127.50000: Flags [.], seq 76745:78193, ack 50680, win 40192, options [nop,nop,TS val 2911818 ecr 472677076], length 1448
15:41:02.753780 IP 10.1.1.134.53854 > 10.1.1.127.50000: Flags [.], seq 78193:79641, ack 50680, win 40192, options [nop,nop,TS val 2911818 ecr 472677076], length 1448
15:41:02.753904 IP 10.1.1.134.53854 > 10.1.1.127.50000: Flags [P.], seq 79641:81089, ack 55024, win 39440, options [nop,nop,TS val 2911818 ecr 472677076], length 1448
15:41:02.753919 IP 10.1.1.127.50000 > 10.1.1.134.53854: Flags [.], seq 63712:68056, ack 81089, win 406, options [nop,nop,TS val 472677076 ecr 2911818], length 4344
15:41:02.753996 IP 10.1.1.134.53854 > 10.1.1.127.50000: Flags [.], seq 81089:82537, ack 55024, win 39440, options [nop,nop,TS val 2911818 ecr 472677076], length 1448
15:41:02.754003 IP 10.1.1.134.53854 > 10.1.1.127.50000: Flags [.], ack 57920, win 47664, options [nop,nop,TS val 2911818 ecr 472677076], length 0
15:41:02.791837 IP 10.1.1.134.53854 > 10.1.1.127.50000: Flags [.], ack 68056, win 45984, options [nop,nop,TS val 2911828 ecr 472677076], length 0
15:41:02.791851 IP 10.1.1.127.50000 > 10.1.1.134.53854: Flags [.], seq 68056:70952, ack 82537, win 44, options [nop,nop,TS val 472677085 ecr 2911818], length 2896
15:41:02.791859 IP 10.1.1.127.50000 > 10.1.1.134.53854: Flags [.], seq 70952:73848, ack 82537, win 44, options [nop,nop,TS val 472677085 ecr 2911818], length 2896
15:41:02.791922 IP 10.1.1.127.50000 > 10.1.1.134.53854: Flags [.], seq 73848:76744, ack 82537, win 44, options [nop,nop,TS val 472677085 ecr 2911818], length 2896
15:41:02.791932 IP 10.1.1.127.50000 > 10.1.1.134.53854: Flags [.], seq 76744:79640, ack 82537, win 44, options [nop,nop,TS val 472677085 ecr 2911818], length 2896
15:41:02.792038 IP 10.1.1.127.50000 > 10.1.1.134.53854: Flags [.], seq 79640:82536, ack 82537, win 44, options [nop,nop,TS val 472677086 ecr 2911818], length 2896
15:41:02.807997 IP 10.1.1.127.50000 > 10.1.1.134.53854: Flags [.], seq 82536:83984, ack 82537, win 44, options [nop,nop,TS val 472677090 ecr 2911818], length 1448
15:41:02.831724 IP 10.1.1.134.53854 > 10.1.1.127.50000: Flags [.], ack 83984, win 43312, options [nop,nop,TS val 2911838 ecr 472677085], length 0
15:41:02.831746 IP 10.1.1.127.50000 > 10.1.1.134.53854: Flags [.], seq 83984:86880, ack 82537, win 44, options [nop,nop,TS val 472677095 ecr 2911838], length 2896
15:41:02.831755 IP 10.1.1.127.50000 > 10.1.1.134.53854: Flags [P.], seq 86880:88328, ack 82537, win 44, options [nop,nop,TS val 472677095 ecr 2911838], length 1448
15:41:02.831793 IP 10.1.1.127.50000 > 10.1.1.134.53854: Flags [.], seq 88328:91224, ack 82537, win 44, options [nop,nop,TS val 472677095 ecr 2911838], length 2896
15:41:02.831807 IP 10.1.1.127.50000 > 10.1.1.134.53854: Flags [.], seq 91224:94120, ack 82537, win 44, options [nop,nop,TS val 472677095 ecr 2911838], length 2896
15:41:02.831816 IP 10.1.1.127.50000 > 10.1.1.134.53854: Flags [.], seq 94120:97016, ack 82537, win 44, options [nop,nop,TS val 472677095 ecr 2911838], length 2896
15:41:02.831935 IP 10.1.1.127.50000 > 10.1.1.134.53854: Flags [.], ack 82537, win 9968, options [nop,nop,TS val 472677095 ecr 2911838], length 0
15:41:02.832385 IP 10.1.1.127.50000 > 10.1.1.134.53854: Flags [.], seq 97016:98464, ack 82537, win 9968, options [nop,nop,TS val 472677096 ecr 2911838], length 1448
15:41:02.833877 IP 10.1.1.134.53854 > 10.1.1.127.50000: Flags [.], seq 82537:83985, ack 98464, win 40912, options [nop,nop,TS val 2911838 ecr 472677095], length 1448
15:41:02.833906 IP 10.1.1.127.50000 > 10.1.1.134.53854: Flags [.], seq 98464:101360, ack 83985, win 9728, options [nop,nop,TS val 472677096 ecr 2911838], length 2896
15:41:02.833916 IP 10.1.1.127.50000 > 10.1.1.134.53854: Flags [.], seq 101360:104256, ack 83985, win 9728, options [nop,nop,TS val 472677096 ecr 2911838], length 2896
15:41:02.833981 IP 10.1.1.127.50000 > 10.1.1.134.53854: Flags [.], seq 104256:107152, ack 83985, win 9728, options [nop,nop,TS val 472677096 ecr 2911838], length 2896
15:41:02.833990 IP 10.1.1.127.50000 > 10.1.1.134.53854: Flags [.], seq 107152:110048, ack 83985, win 9728, options [nop,nop,TS val 472677096 ecr 2911838], length 2896
15:41:02.834033 IP 10.1.1.127.50000 > 10.1.1.134.53854: Flags [.], seq 110048:112944, ack 83985, win 9728, options [nop,nop,TS val 472677096 ecr 2911838], length 2896
15:41:02.834033 IP 10.1.1.134.53854 > 10.1.1.127.50000: Flags [.], seq 83985:85433, ack 98464, win 40912, options [nop,nop,TS val 2911838 ecr 472677095], length 1448
15:41:02.834284 IP 10.1.1.134.53854 > 10.1.1.127.50000: Flags [P.], seq 85433:88329, ack 98464, win 40912, options [nop,nop,TS val 2911838 ecr 472677095], length 2896
15:41:02.834303 IP 10.1.1.134.53854 > 10.1.1.127.50000: Flags [.], seq 88329:89777, ack 98464, win 40912, options [nop,nop,TS val 2911838 ecr 472677095], length 1448
15:41:02.834308 IP 10.1.1.134.53854 > 10.1.1.127.50000: Flags [.], ack 98464, win 40912, options [nop,nop,TS val 2911838 ecr 472677095], length 0
15:41:02.834546 IP 10.1.1.134.53854 > 10.1.1.127.50000: Flags [.], seq 89777:91225, ack 98464, win 40912, options [nop,nop,TS val 2911838 ecr 472677095], length 1448
15:41:02.834580 IP 10.1.1.134.53854 > 10.1.1.127.50000: Flags [.], seq 91225:92673, ack 98464, win 40912, options [nop,nop,TS val 2911838 ecr 472677095], length 1448
15:41:02.834752 IP 10.1.1.134.53854 > 10.1.1.127.50000: Flags [.], seq 92673:94121, ack 98464, win 40912, options [nop,nop,TS val 2911838 ecr 472677095], length 1448
15:41:02.834896 IP 10.1.1.134.53854 > 10.1.1.127.50000: Flags [.], seq 94121:95569, ack 98464, win 40912, options [nop,nop,TS val 2911838 ecr 472677095], length 1448
15:41:02.835018 IP 10.1.1.134.53854 > 10.1.1.127.50000: Flags [.], seq 95569:97017, ack 98464, win 40912, options [nop,nop,TS val 2911838 ecr 472677095], length 1448
15:41:02.835137 IP 10.1.1.134.53854 > 10.1.1.127.50000: Flags [P.], seq 97017:98465, ack 98464, win 40912, options [nop,nop,TS val 2911838 ecr 472677095], length 1448
15:41:02.835222 IP 10.1.1.134.53854 > 10.1.1.127.50000: Flags [.], seq 98465:99913, ack 98464, win 40912, options [nop,nop,TS val 2911838 ecr 472677095], length 1448
15:41:02.835357 IP 10.1.1.134.53854 > 10.1.1.127.50000: Flags [P.], seq 99913:101361, ack 98464, win 40912, options [nop,nop,TS val 2911838 ecr 472677095], length 1448
15:41:02.835490 IP 10.1.1.134.53854 > 10.1.1.127.50000: Flags [.], seq 101361:102809, ack 98464, win 40912, options [nop,nop,TS val 2911838 ecr 472677095], length 1448
15:41:02.835569 IP 10.1.1.134.53854 > 10.1.1.127.50000: Flags [.], seq 102809:104257, ack 98464, win 40912, options [nop,nop,TS val 2911838 ecr 472677095], length 1448
15:41:02.835678 IP 10.1.1.134.53854 > 10.1.1.127.50000: Flags [.], seq 104257:105705, ack 98464, win 40912, options [nop,nop,TS val 2911838 ecr 472677095], length 1448
15:41:02.835813 IP 10.1.1.134.53854 > 10.1.1.127.50000: Flags [.], seq 105705:107153, ack 99912, win 40672, options [nop,nop,TS val 2911838 ecr 472677096], length 1448
15:41:02.835937 IP 10.1.1.134.53854 > 10.1.1.127.50000: Flags [.], seq 107153:108601, ack 99912, win 40672, options [nop,nop,TS val 2911838 ecr 472677096], length 1448
15:41:02.836043 IP 10.1.1.134.53854 > 10.1.1.127.50000: Flags [.], seq 108601:110037, ack 99912, win 40672, options [nop,nop,TS val 2911838 ecr 472677096,nop,nop,sack 1 {101360:102808}], length 1436
15:41:02.836061 IP 10.1.1.127.50000 > 10.1.1.134.53854: Flags [.], seq 112944:115840, ack 110037, win 5376, options [nop,nop,TS val 472677097 ecr 2911838], length 2896
15:41:02.836067 IP 10.1.1.134.53854 > 10.1.1.127.50000: Flags [.], ack 102808, win 40192, options [nop,nop,TS val 2911838 ecr 472677096], length 0
15:41:02.836074 IP 10.1.1.134.53854 > 10.1.1.127.50000: Flags [.], ack 104256, win 39920, options [nop,nop,TS val 2911838 ecr 472677096], length 0
15:41:02.836078 IP 10.1.1.127.50000 > 10.1.1.134.53854: Flags [.], seq 115840:118736, ack 110037, win 5376, options [nop,nop,TS val 472677097 ecr 2911838], length 2896
15:41:02.836085 IP 10.1.1.134.53854 > 10.1.1.127.50000: Flags [.], seq 110037:110049, ack 104256, win 39920, options [nop,nop,TS val 2911838 ecr 472677096], length 12
15:41:02.836207 IP 10.1.1.134.53854 > 10.1.1.127.50000: Flags [.], seq 110049:111497, ack 104256, win 39920, options [nop,nop,TS val 2911838 ecr 472677096], length 1448
15:41:02.836316 IP 10.1.1.134.53854 > 10.1.1.127.50000: Flags [.], seq 111497:112945, ack 104256, win 39920, options [nop,nop,TS val 2911838 ecr 472677096], length 1448
15:41:02.836455 IP 10.1.1.134.53854 > 10.1.1.127.50000: Flags [.], seq 112945:114393, ack 105704, win 39680, options [nop,nop,TS val 2911838 ecr 472677096], length 1448
15:41:02.836577 IP 10.1.1.134.53854 > 10.1.1.127.50000: Flags [.], seq 114393:115841, ack 107152, win 39440, options [nop,nop,TS val 2911838 ecr 472677096], length 1448
15:41:02.836757 IP 10.1.1.134.53854 > 10.1.1.127.50000: Flags [.], seq 115841:117289, ack 108600, win 39200, options [nop,nop,TS val 2911838 ecr 472677096], length 1448
15:41:02.836776 IP 10.1.1.127.50000 > 10.1.1.134.53854: Flags [.], seq 118736:123080, ack 117289, win 4080, options [nop,nop,TS val 472677097 ecr 2911838], length 4344
15:41:02.836820 IP 10.1.1.134.53854 > 10.1.1.127.50000: Flags [.], seq 117289:118737, ack 108600, win 39200, options [nop,nop,TS val 2911838 ecr 472677096], length 1448
15:41:02.836974 IP 10.1.1.134.53854 > 10.1.1.127.50000: Flags [.], seq 118737:120185, ack 112944, win 38480, options [nop,nop,TS val 2911839 ecr 472677096], length 1448
15:41:02.836997 IP 10.1.1.127.50000 > 10.1.1.134.53854: Flags [.], seq 123080:127424, ack 120185, win 3600, options [nop,nop,TS val 472677097 ecr 2911838], length 4344
15:41:02.837076 IP 10.1.1.134.53854 > 10.1.1.127.50000: Flags [.], seq 120185:121633, ack 112944, win 38480, options [nop,nop,TS val 2911839 ecr 472677096], length 1448
15:41:02.837222 IP 10.1.1.134.53854 > 10.1.1.127.50000: Flags [.], seq 121633:123081, ack 114392, win 38240, options [nop,nop,TS val 2911839 ecr 472677097], length 1448
15:41:02.837330 IP 10.1.1.134.53854 > 10.1.1.127.50000: Flags [.], seq 123081:124529, ack 114392, win 38240, options [nop,nop,TS val 2911839 ecr 472677097], length 1448
15:41:02.837484 IP 10.1.1.134.53854 > 10.1.1.127.50000: Flags [.], seq 124529:125977, ack 114392, win 38240, options [nop,nop,TS val 2911839 ecr 472677097], length 1448
15:41:02.837610 IP 10.1.1.134.53854 > 10.1.1.127.50000: Flags [P.], seq 125977:127425, ack 114392, win 38240, options [nop,nop,TS val 2911839 ecr 472677097], length 1448
15:41:02.837732 IP 10.1.1.134.53854 > 10.1.1.127.50000: Flags [.], seq 127425:128873, ack 114392, win 38240, options [nop,nop,TS val 2911839 ecr 472677097], length 1448
15:41:02.837826 IP 10.1.1.134.53854 > 10.1.1.127.50000: Flags [.], seq 128873:130321, ack 114392, win 38240, options [nop,nop,TS val 2911839 ecr 472677097], length 1448
15:41:02.837993 IP 10.1.1.134.53854 > 10.1.1.127.50000: Flags [.], seq 130321:131769, ack 120184, win 37280, options [nop,nop,TS val 2911839 ecr 472677097], length 1448
15:41:02.838013 IP 10.1.1.127.50000 > 10.1.1.134.53854: Flags [.], seq 127424:133216, ack 131769, win 704, options [nop,nop,TS val 472677097 ecr 2911839], length 5792
15:41:02.838094 IP 10.1.1.134.53854 > 10.1.1.127.50000: Flags [.], seq 131769:133217, ack 120184, win 37280, options [nop,nop,TS val 2911839 ecr 472677097], length 1448
15:41:02.838947 IP 10.1.1.134.53854 > 10.1.1.127.50000: Flags [.], ack 128872, win 48896, options [nop,nop,TS val 2911839 ecr 472677097], length 0
15:41:02.838961 IP 10.1.1.127.50000 > 10.1.1.134.53854: Flags [.], seq 133216:139008, ack 133217, win 342, options [nop,nop,TS val 472677097 ecr 2911839], length 5792
15:41:02.839046 IP 10.1.1.134.53854 > 10.1.1.127.50000: Flags [.], ack 131768, win 48384, options [nop,nop,TS val 2911839 ecr 472677097], length 0
15:41:02.839061 IP 10.1.1.127.50000 > 10.1.1.134.53854: Flags [.], seq 139008:146248, ack 133217, win 342, options [nop,nop,TS val 472677097 ecr 2911839], length 7240
15:41:02.847995 IP 10.1.1.127.50000 > 10.1.1.134.53854: Flags [.], seq 146248:147696, ack 133217, win 342, options [nop,nop,TS val 472677100 ecr 2911839], length 1448
15:41:02.875684 IP 10.1.1.134.53854 > 10.1.1.127.50000: Flags [.], ack 147696, win 45744, options [nop,nop,TS val 2911849 ecr 472677097], length 0
15:41:02.875700 IP 10.1.1.127.50000 > 10.1.1.134.53854: Flags [.], seq 147696:152040, ack 133217, win 342, options [nop,nop,TS val 472677106 ecr 2911849], length 4344
15:41:02.875708 IP 10.1.1.127.50000 > 10.1.1.134.53854: Flags [.], seq 152040:156384, ack 133217, win 342, options [nop,nop,TS val 472677106 ecr 2911849], length 4344
15:41:02.875803 IP 10.1.1.127.50000 > 10.1.1.134.53854: Flags [.], seq 156384:160728, ack 133217, win 342, options [nop,nop,TS val 472677106 ecr 2911849], length 4344
15:41:02.875817 IP 10.1.1.127.50000 > 10.1.1.134.53854: Flags [P.], seq 160728:163624, ack 133217, win 342, options [nop,nop,TS val 472677106 ecr 2911849], length 2896
15:41:02.887997 IP 10.1.1.127.50000 > 10.1.1.134.53854: Flags [P.], seq 162176:163624, ack 133217, win 342, options [nop,nop,TS val 472677110 ecr 2911849], length 1448
15:41:02.889108 IP 10.1.1.134.53854 > 10.1.1.127.50000: Flags [.], ack 163624, win 43072, options [nop,nop,TS val 2911852 ecr 472677106,nop,nop,sack 1 {162176:163624}], length 0
15:41:02.889154 IP 10.1.1.127.50000 > 10.1.1.134.53854: Flags [.], seq 163624:166520, ack 133217, win 342, options [nop,nop,TS val 472677110 ecr 2911852], length 2896
15:41:02.889162 IP 10.1.1.127.50000 > 10.1.1.134.53854: Flags [.], seq 166520:169416, ack 133217, win 342, options [nop,nop,TS val 472677110 ecr 2911852], length 2896
15:41:02.889168 IP 10.1.1.127.50000 > 10.1.1.134.53854: Flags [.], seq 169416:172312, ack 133217, win 342, options [nop,nop,TS val 472677110 ecr 2911852], length 2896
15:41:02.889243 IP 10.1.1.127.50000 > 10.1.1.134.53854: Flags [.], seq 172312:175208, ack 133217, win 342, options [nop,nop,TS val 472677110 ecr 2911852], length 2896
15:41:02.889251 IP 10.1.1.127.50000 > 10.1.1.134.53854: Flags [.], seq 175208:178104, ack 133217, win 342, options [nop,nop,TS val 472677110 ecr 2911852], length 2896
15:41:02.889311 IP 10.1.1.127.50000 > 10.1.1.134.53854: Flags [.], ack 133217, win 14496, options [nop,nop,TS val 472677110 ecr 2911852], length 0
15:41:02.889343 IP 10.1.1.127.50000 > 10.1.1.134.53854: Flags [P.], seq 178104:178648, ack 133217, win 14496, options [nop,nop,TS val 472677110 ecr 2911852], length 544
15:41:02.890285 IP 10.1.1.134.53854 > 10.1.1.127.50000: Flags [.], ack 165072, win 42832, options [nop,nop,TS val 2911852 ecr 472677110], length 0
15:41:02.890484 IP 10.1.1.134.53854 > 10.1.1.127.50000: Flags [.], ack 166520, win 42592, options [nop,nop,TS val 2911852 ecr 472677110], length 0
15:41:02.890501 IP 10.1.1.134.53854 > 10.1.1.127.50000: Flags [.], ack 167968, win 42352, options [nop,nop,TS val 2911852 ecr 472677110], length 0
15:41:02.890510 IP 10.1.1.134.53854 > 10.1.1.127.50000: Flags [.], ack 169416, win 42112, options [nop,nop,TS val 2911852 ecr 472677110], length 0
15:41:02.890516 IP 10.1.1.134.53854 > 10.1.1.127.50000: Flags [.], ack 170864, win 41872, options [nop,nop,TS val 2911852 ecr 472677110], length 0
15:41:02.890520 IP 10.1.1.134.53854 > 10.1.1.127.50000: Flags [.], ack 172312, win 41632, options [nop,nop,TS val 2911852 ecr 472677110], length 0
15:41:02.890566 IP 10.1.1.127.50000 > 10.1.1.134.53854: Flags [.], seq 178648:184440, ack 133217, win 14496, options [nop,nop,TS val 472677110 ecr 2911852], length 5792
15:41:02.890610 IP 10.1.1.134.53854 > 10.1.1.127.50000: Flags [.], ack 173760, win 41392, options [nop,nop,TS val 2911852 ecr 472677110], length 0
15:41:02.890731 IP 10.1.1.134.53854 > 10.1.1.127.50000: Flags [.], ack 175208, win 41152, options [nop,nop,TS val 2911852 ecr 472677110], length 0
15:41:02.890862 IP 10.1.1.134.53854 > 10.1.1.127.50000: Flags [.], ack 176656, win 40912, options [nop,nop,TS val 2911852 ecr 472677110], length 0
15:41:02.890873 IP 10.1.1.127.50000 > 10.1.1.134.53854: Flags [.], seq 184440:190232, ack 133217, win 23200, options [nop,nop,TS val 472677110 ecr 2911852], length 5792
15:41:02.890987 IP 10.1.1.134.53854 > 10.1.1.127.50000: Flags [.], ack 178104, win 40672, options [nop,nop,TS val 2911852 ecr 472677110], length 0
15:41:02.891100 IP 10.1.1.127.50000 > 10.1.1.134.53854: Flags [.], seq 190232:191680, ack 133217, win 23200, options [nop,nop,TS val 472677110 ecr 2911852], length 1448
15:41:02.891498 IP 10.1.1.134.53854 > 10.1.1.127.50000: Flags [P.], seq 133217:134665, ack 178104, win 40672, options [nop,nop,TS val 2911852 ecr 472677110], length 1448
15:41:02.891519 IP 10.1.1.134.53854 > 10.1.1.127.50000: Flags [.], seq 134665:136113, ack 178104, win 40672, options [nop,nop,TS val 2911852 ecr 472677110], length 1448
15:41:02.891805 IP 10.1.1.134.53854 > 10.1.1.127.50000: Flags [.], seq 136113:140457, ack 178104, win 40672, options [nop,nop,TS val 2911852 ecr 472677110], length 4344
15:41:02.892010 IP 10.1.1.134.53854 > 10.1.1.127.50000: Flags [.], seq 140457:141905, ack 178104, win 40672, options [nop,nop,TS val 2911852 ecr 472677110], length 1448
15:41:02.892189 IP 10.1.1.134.53854 > 10.1.1.127.50000: Flags [.], seq 141905:144801, ack 178104, win 40672, options [nop,nop,TS val 2911852 ecr 472677110], length 2896
15:41:02.892314 IP 10.1.1.134.53854 > 10.1.1.127.50000: Flags [.], seq 144801:146249, ack 178648, win 40544, options [nop,nop,TS val 2911852 ecr 472677110], length 1448
15:41:02.892469 IP 10.1.1.134.53854 > 10.1.1.127.50000: Flags [.], seq 146249:147697, ack 178648, win 40544, options [nop,nop,TS val 2911852 ecr 472677110], length 1448
15:41:02.892522 IP 10.1.1.134.53854 > 10.1.1.127.50000: Flags [.], seq 147697:149145, ack 178648, win 40544, options [nop,nop,TS val 2911852 ecr 472677110], length 1448
15:41:02.892690 IP 10.1.1.134.53854 > 10.1.1.127.50000: Flags [.], seq 149145:150593, ack 178648, win 40544, options [nop,nop,TS val 2911852 ecr 472677110], length 1448
15:41:02.892832 IP 10.1.1.134.53854 > 10.1.1.127.50000: Flags [.], seq 150593:152041, ack 181544, win 40032, options [nop,nop,TS val 2911852 ecr 472677110], length 1448
15:41:02.892920 IP 10.1.1.134.53854 > 10.1.1.127.50000: Flags [.], seq 152041:153489, ack 181544, win 40032, options [nop,nop,TS val 2911852 ecr 472677110], length 1448
15:41:02.893055 IP 10.1.1.134.53854 > 10.1.1.127.50000: Flags [.], seq 153489:154937, ack 181544, win 40032, options [nop,nop,TS val 2911852 ecr 472677110], length 1448
15:41:02.893159 IP 10.1.1.134.53854 > 10.1.1.127.50000: Flags [.], seq 154937:156385, ack 182992, win 39792, options [nop,nop,TS val 2911853 ecr 472677110], length 1448
15:41:02.893181 IP 10.1.1.127.50000 > 10.1.1.134.53854: Flags [.], seq 191680:197472, ack 156385, win 19328, options [nop,nop,TS val 472677111 ecr 2911852], length 5792
15:41:02.893278 IP 10.1.1.134.53854 > 10.1.1.127.50000: Flags [.], seq 156385:157833, ack 184440, win 39552, options [nop,nop,TS val 2911853 ecr 472677110], length 1448
15:41:02.893417 IP 10.1.1.134.53854 > 10.1.1.127.50000: Flags [P.], seq 157833:159281, ack 185888, win 39312, options [nop,nop,TS val 2911853 ecr 472677110], length 1448
15:41:02.893528 IP 10.1.1.134.53854 > 10.1.1.127.50000: Flags [.], seq 159281:160729, ack 187336, win 39072, options [nop,nop,TS val 2911853 ecr 472677110], length 1448
15:41:02.893617 IP 10.1.1.134.53854 > 10.1.1.127.50000: Flags [.], seq 160729:162177, ack 188784, win 38832, options [nop,nop,TS val 2911853 ecr 472677110], length 1448
15:41:02.893633 IP 10.1.1.127.50000 > 10.1.1.134.53854: Flags [.], seq 197472:203264, ack 162177, win 18336, options [nop,nop,TS val 472677111 ecr 2911853], length 5792
15:41:02.893748 IP 10.1.1.134.53854 > 10.1.1.127.50000: Flags [P.], seq 162177:163625, ack 190232, win 38592, options [nop,nop,TS val 2911853 ecr 472677110], length 1448
15:41:02.893872 IP 10.1.1.134.53854 > 10.1.1.127.50000: Flags [.], seq 163625:165073, ack 191680, win 38352, options [nop,nop,TS val 2911853 ecr 472677110], length 1448
15:41:02.893995 IP 10.1.1.134.53854 > 10.1.1.127.50000: Flags [.], seq 165073:166521, ack 191680, win 38352, options [nop,nop,TS val 2911853 ecr 472677110], length 1448
15:41:02.894105 IP 10.1.1.134.53854 > 10.1.1.127.50000: Flags [.], seq 166521:167969, ack 191680, win 38352, options [nop,nop,TS val 2911853 ecr 472677110], length 1448
15:41:02.894242 IP 10.1.1.134.53854 > 10.1.1.127.50000: Flags [.], seq 167969:169417, ack 191680, win 38352, options [nop,nop,TS val 2911853 ecr 472677110], length 1448
15:41:02.894364 IP 10.1.1.134.53854 > 10.1.1.127.50000: Flags [P.], seq 169417:170865, ack 191680, win 38352, options [nop,nop,TS val 2911853 ecr 472677110], length 1448
15:41:02.894488 IP 10.1.1.134.53854 > 10.1.1.127.50000: Flags [.], seq 170865:172313, ack 191680, win 38352, options [nop,nop,TS val 2911853 ecr 472677110], length 1448
15:41:02.894628 IP 10.1.1.134.53854 > 10.1.1.127.50000: Flags [.], seq 172313:173761, ack 191680, win 38352, options [nop,nop,TS val 2911853 ecr 472677110], length 1448
15:41:02.894796 IP 10.1.1.134.53854 > 10.1.1.127.50000: Flags [.], seq 173761:175209, ack 191680, win 38352, options [nop,nop,TS val 2911853 ecr 472677110], length 1448
15:41:02.894900 IP 10.1.1.134.53854 > 10.1.1.127.50000: Flags [.], seq 175209:176657, ack 191680, win 38352, options [nop,nop,TS val 2911853 ecr 472677110], length 1448
15:41:02.895026 IP 10.1.1.134.53854 > 10.1.1.127.50000: Flags [P.], seq 176657:178105, ack 191680, win 38352, options [nop,nop,TS val 2911853 ecr 472677110], length 1448
15:41:02.895131 IP 10.1.1.134.53854 > 10.1.1.127.50000: Flags [.], seq 178105:179553, ack 191680, win 38352, options [nop,nop,TS val 2911853 ecr 472677110], length 1448
15:41:02.895275 IP 10.1.1.134.53854 > 10.1.1.127.50000: Flags [.], seq 179553:181001, ack 191680, win 38352, options [nop,nop,TS val 2911853 ecr 472677110], length 1448
15:41:02.895354 IP 10.1.1.134.53854 > 10.1.1.127.50000: Flags [.], seq 181001:182449, ack 191680, win 38352, options [nop,nop,TS val 2911853 ecr 472677110], length 1448
15:41:02.895535 IP 10.1.1.134.53854 > 10.1.1.127.50000: Flags [.], seq 182449:183897, ack 193128, win 38112, options [nop,nop,TS val 2911853 ecr 472677111], length 1448
15:41:02.895554 IP 10.1.1.127.50000 > 10.1.1.134.53854: Flags [.], seq 203264:209056, ack 183897, win 14736, options [nop,nop,TS val 472677111 ecr 2911853], length 5792
15:41:02.895595 IP 10.1.1.134.53854 > 10.1.1.127.50000: Flags [.], seq 183897:185345, ack 193128, win 38112, options [nop,nop,TS val 2911853 ecr 472677111], length 1448
15:41:02.895782 IP 10.1.1.134.53854 > 10.1.1.127.50000: Flags [.], seq 185345:186793, ack 193128, win 38112, options [nop,nop,TS val 2911853 ecr 472677111], length 1448
15:41:02.895887 IP 10.1.1.134.53854 > 10.1.1.127.50000: Flags [.], seq 186793:188241, ack 194576, win 37872, options [nop,nop,TS val 2911853 ecr 472677111], length 1448
15:41:02.896016 IP 10.1.1.134.53854 > 10.1.1.127.50000: Flags [.], seq 188241:189689, ack 197472, win 37392, options [nop,nop,TS val 2911853 ecr 472677111], length 1448
15:41:02.896112 IP 10.1.1.134.53854 > 10.1.1.127.50000: Flags [.], seq 189689:191137, ack 198920, win 37152, options [nop,nop,TS val 2911853 ecr 472677111], length 1448
15:41:02.896131 IP 10.1.1.127.50000 > 10.1.1.134.53854: Flags [.], seq 209056:214848, ack 191137, win 13504, options [nop,nop,TS val 472677112 ecr 2911853], length 5792
15:41:02.896237 IP 10.1.1.134.53854 > 10.1.1.127.50000: Flags [.], seq 191137:192585, ack 200368, win 36912, options [nop,nop,TS val 2911853 ecr 472677111], length 1448
15:41:02.896341 IP 10.1.1.134.53854 > 10.1.1.127.50000: Flags [.], seq 192585:194033, ack 201816, win 36672, options [nop,nop,TS val 2911853 ecr 472677111], length 1448
15:41:02.896464 IP 10.1.1.134.53854 > 10.1.1.127.50000: Flags [.], seq 194033:195481, ack 203264, win 36432, options [nop,nop,TS val 2911853 ecr 472677111], length 1448
15:41:02.896572 IP 10.1.1.134.53854 > 10.1.1.127.50000: Flags [.], seq 195481:196929, ack 203264, win 36432, options [nop,nop,TS val 2911853 ecr 472677111], length 1448
15:41:02.896709 IP 10.1.1.134.53854 > 10.1.1.127.50000: Flags [.], seq 196929:198377, ack 203264, win 36432, options [nop,nop,TS val 2911853 ecr 472677111], length 1448
15:41:02.896831 IP 10.1.1.134.53854 > 10.1.1.127.50000: Flags [.], seq 198377:199825, ack 203264, win 36432, options [nop,nop,TS val 2911853 ecr 472677111], length 1448
15:41:02.896955 IP 10.1.1.134.53854 > 10.1.1.127.50000: Flags [P.], seq 199825:201273, ack 203264, win 36432, options [nop,nop,TS val 2911853 ecr 472677111], length 1448
15:41:02.897065 IP 10.1.1.134.53854 > 10.1.1.127.50000: Flags [.], seq 201273:202721, ack 203264, win 36432, options [nop,nop,TS val 2911853 ecr 472677111], length 1448
15:41:02.897202 IP 10.1.1.134.53854 > 10.1.1.127.50000: Flags [.], seq 202721:204169, ack 203264, win 36432, options [nop,nop,TS val 2911853 ecr 472677111], length 1448
15:41:02.897385 IP 10.1.1.134.53854 > 10.1.1.127.50000: Flags [.], seq 204169:205617, ack 203264, win 36432, options [nop,nop,TS val 2911854 ecr 472677111], length 1448
15:41:02.897489 IP 10.1.1.134.53854 > 10.1.1.127.50000: Flags [.], seq 205617:207065, ack 203264, win 36432, options [nop,nop,TS val 2911854 ecr 472677111], length 1448
15:41:02.897597 IP 10.1.1.134.53854 > 10.1.1.127.50000: Flags [.], seq 207065:208513, ack 203264, win 36432, options [nop,nop,TS val 2911854 ecr 472677111], length 1448
15:41:02.897741 IP 10.1.1.134.53854 > 10.1.1.127.50000: Flags [.], seq 208513:209961, ack 203264, win 36432, options [nop,nop,TS val 2911854 ecr 472677111], length 1448
