15:24:34.273864 IP bob.localdomain.ssh > ankit-XPS-13-9350.localdomain.60680: Flags [P.], seq 590892225:590892421, ack 4151968858, win 348, options [nop,nop,TS val 450829956 ecr 14872441], length 196
15:24:34.274513 IP ankit-XPS-13-9350.localdomain.60680 > bob.localdomain.ssh: Flags [.], ack 196, win 10090, options [nop,nop,TS val 14872458 ecr 450829956], length 0
15:24:34.295509 IP ankit-XPS-13-9350.localdomain.47190 > bob.localdomain.50000: Flags [.], ack 1492188545, win 34848, options [nop,nop,TS val 14872464 ecr 450829951], length 0
15:24:34.295528 IP bob.localdomain.50000 > ankit-XPS-13-9350.localdomain.47190: Flags [P.], seq 1:2897, ack 0, win 300, options [nop,nop,TS val 450829961 ecr 14872464], length 2896
15:24:34.295568 IP bob.localdomain.50000 > ankit-XPS-13-9350.localdomain.47190: Flags [.], seq 2897:5793, ack 0, win 300, options [nop,nop,TS val 450829961 ecr 14872464], length 2896
15:24:34.295574 IP bob.localdomain.50000 > ankit-XPS-13-9350.localdomain.47190: Flags [.], seq 5793:8689, ack 0, win 300, options [nop,nop,TS val 450829961 ecr 14872464], length 2896
15:24:34.295618 IP bob.localdomain.50000 > ankit-XPS-13-9350.localdomain.47190: Flags [.], seq 8689:11585, ack 0, win 300, options [nop,nop,TS val 450829961 ecr 14872464], length 2896
15:24:34.295676 IP bob.localdomain.50000 > ankit-XPS-13-9350.localdomain.47190: Flags [.], seq 11585:14481, ack 0, win 300, options [nop,nop,TS val 450829961 ecr 14872464], length 2896
15:24:34.295686 IP bob.localdomain.50000 > ankit-XPS-13-9350.localdomain.47190: Flags [.], seq 14481:17377, ack 0, win 300, options [nop,nop,TS val 450829961 ecr 14872464], length 2896
15:24:34.295731 IP bob.localdomain.50000 > ankit-XPS-13-9350.localdomain.47190: Flags [.], ack 0, win 15488, options [nop,nop,TS val 450829961 ecr 14872464], length 0
15:24:34.295784 IP bob.localdomain.50000 > ankit-XPS-13-9350.localdomain.47190: Flags [.], seq 17377:20273, ack 0, win 15488, options [nop,nop,TS val 450829961 ecr 14872464], length 2896
15:24:34.295796 IP bob.localdomain.50000 > ankit-XPS-13-9350.localdomain.47190: Flags [.], seq 20273:23169, ack 0, win 15488, options [nop,nop,TS val 450829961 ecr 14872464], length 2896
15:24:34.296042 IP bob.localdomain.50000 > ankit-XPS-13-9350.localdomain.47190: Flags [.], seq 23169:24617, ack 0, win 15488, options [nop,nop,TS val 450829962 ecr 14872464], length 1448
15:24:34.297959 IP ankit-XPS-13-9350.localdomain.47190 > bob.localdomain.50000: Flags [P.], seq 0:2896, ack 17377, win 31968, options [nop,nop,TS val 14872464 ecr 450829961], length 2896
15:24:34.297987 IP bob.localdomain.50000 > ankit-XPS-13-9350.localdomain.47190: Flags [.], seq 24617:27513, ack 2896, win 14976, options [nop,nop,TS val 450829962 ecr 14872464], length 2896
15:24:34.297994 IP bob.localdomain.50000 > ankit-XPS-13-9350.localdomain.47190: Flags [.], seq 27513:30409, ack 2896, win 14976, options [nop,nop,TS val 450829962 ecr 14872464], length 2896
15:24:34.298036 IP bob.localdomain.50000 > ankit-XPS-13-9350.localdomain.47190: Flags [.], seq 30409:33305, ack 2896, win 14976, options [nop,nop,TS val 450829962 ecr 14872464], length 2896
15:24:34.298081 IP bob.localdomain.50000 > ankit-XPS-13-9350.localdomain.47190: Flags [.], seq 33305:36201, ack 2896, win 14976, options [nop,nop,TS val 450829962 ecr 14872464], length 2896
15:24:34.298124 IP ankit-XPS-13-9350.localdomain.47190 > bob.localdomain.50000: Flags [.], seq 2896:4344, ack 17377, win 31968, options [nop,nop,TS val 14872464 ecr 450829961], length 1448
15:24:34.298130 IP bob.localdomain.50000 > ankit-XPS-13-9350.localdomain.47190: Flags [.], seq 36201:39097, ack 2896, win 14976, options [nop,nop,TS val 450829962 ecr 14872464], length 2896
15:24:34.298135 IP bob.localdomain.50000 > ankit-XPS-13-9350.localdomain.47190: Flags [.], seq 39097:41993, ack 2896, win 14976, options [nop,nop,TS val 450829962 ecr 14872464], length 2896
15:24:34.298274 IP ankit-XPS-13-9350.localdomain.47190 > bob.localdomain.50000: Flags [.], seq 4344:5792, ack 17377, win 31968, options [nop,nop,TS val 14872464 ecr 450829961], length 1448
15:24:34.298407 IP ankit-XPS-13-9350.localdomain.47190 > bob.localdomain.50000: Flags [.], seq 5792:7240, ack 17377, win 31968, options [nop,nop,TS val 14872464 ecr 450829961], length 1448
15:24:34.298517 IP ankit-XPS-13-9350.localdomain.47190 > bob.localdomain.50000: Flags [P.], seq 7240:8688, ack 17377, win 31968, options [nop,nop,TS val 14872464 ecr 450829961], length 1448
15:24:34.298652 IP ankit-XPS-13-9350.localdomain.47190 > bob.localdomain.50000: Flags [.], seq 8688:10136, ack 18825, win 31728, options [nop,nop,TS val 14872464 ecr 450829961], length 1448
15:24:34.298778 IP ankit-XPS-13-9350.localdomain.47190 > bob.localdomain.50000: Flags [.], seq 10136:11584, ack 18825, win 31728, options [nop,nop,TS val 14872464 ecr 450829961], length 1448
15:24:34.298899 IP ankit-XPS-13-9350.localdomain.47190 > bob.localdomain.50000: Flags [.], seq 11584:13032, ack 18825, win 31728, options [nop,nop,TS val 14872464 ecr 450829961], length 1448
15:24:34.298967 IP ankit-XPS-13-9350.localdomain.47190 > bob.localdomain.50000: Flags [.], seq 13032:14480, ack 18825, win 31728, options [nop,nop,TS val 14872464 ecr 450829961], length 1448
15:24:34.299147 IP ankit-XPS-13-9350.localdomain.47190 > bob.localdomain.50000: Flags [.], seq 14480:15928, ack 20273, win 31488, options [nop,nop,TS val 14872464 ecr 450829961], length 1448
15:24:34.299268 IP ankit-XPS-13-9350.localdomain.47190 > bob.localdomain.50000: Flags [.], seq 15928:17376, ack 20273, win 31488, options [nop,nop,TS val 14872464 ecr 450829961], length 1448
15:24:34.299390 IP ankit-XPS-13-9350.localdomain.47190 > bob.localdomain.50000: Flags [.], seq 17376:18824, ack 23169, win 30976, options [nop,nop,TS val 14872464 ecr 450829961], length 1448
15:24:34.299412 IP bob.localdomain.50000 > ankit-XPS-13-9350.localdomain.47190: Flags [.], seq 41993:46337, ack 18824, win 12336, options [nop,nop,TS val 450829962 ecr 14872464], length 4344
15:24:34.299479 IP ankit-XPS-13-9350.localdomain.47190 > bob.localdomain.50000: Flags [.], seq 18824:20272, ack 23169, win 30976, options [nop,nop,TS val 14872464 ecr 450829961], length 1448
15:24:34.299611 IP ankit-XPS-13-9350.localdomain.47190 > bob.localdomain.50000: Flags [.], seq 20272:21720, ack 24617, win 30736, options [nop,nop,TS val 14872464 ecr 450829962], length 1448
15:24:34.299731 IP ankit-XPS-13-9350.localdomain.47190 > bob.localdomain.50000: Flags [.], seq 21720:23168, ack 24617, win 30736, options [nop,nop,TS val 14872464 ecr 450829962], length 1448
15:24:34.299853 IP ankit-XPS-13-9350.localdomain.47190 > bob.localdomain.50000: Flags [P.], seq 23168:24616, ack 24617, win 30736, options [nop,nop,TS val 14872464 ecr 450829962], length 1448
15:24:34.299989 IP ankit-XPS-13-9350.localdomain.47190 > bob.localdomain.50000: Flags [.], seq 24616:26064, ack 24617, win 30736, options [nop,nop,TS val 14872464 ecr 450829962], length 1448
15:24:34.300112 IP ankit-XPS-13-9350.localdomain.47190 > bob.localdomain.50000: Flags [P.], seq 26064:27512, ack 26065, win 30496, options [nop,nop,TS val 14872464 ecr 450829962], length 1448
15:24:34.300214 IP ankit-XPS-13-9350.localdomain.47190 > bob.localdomain.50000: Flags [.], seq 27512:28960, ack 27513, win 30256, options [nop,nop,TS val 14872464 ecr 450829962], length 1448
15:24:34.300234 IP bob.localdomain.50000 > ankit-XPS-13-9350.localdomain.47190: Flags [.], seq 46337:52129, ack 28960, win 10624, options [nop,nop,TS val 450829963 ecr 14872464], length 5792
15:24:34.300337 IP ankit-XPS-13-9350.localdomain.47190 > bob.localdomain.50000: Flags [.], seq 28960:30408, ack 28961, win 30016, options [nop,nop,TS val 14872464 ecr 450829962], length 1448
15:24:34.300445 IP ankit-XPS-13-9350.localdomain.47190 > bob.localdomain.50000: Flags [.], seq 30408:31856, ack 30409, win 29776, options [nop,nop,TS val 14872464 ecr 450829962], length 1448
15:24:34.300581 IP ankit-XPS-13-9350.localdomain.47190 > bob.localdomain.50000: Flags [.], seq 31856:33304, ack 31857, win 29536, options [nop,nop,TS val 14872464 ecr 450829962], length 1448
15:24:34.300705 IP ankit-XPS-13-9350.localdomain.47190 > bob.localdomain.50000: Flags [.], seq 33304:34752, ack 33305, win 29296, options [nop,nop,TS val 14872464 ecr 450829962], length 1448
15:24:34.300828 IP ankit-XPS-13-9350.localdomain.47190 > bob.localdomain.50000: Flags [.], seq 34752:36200, ack 34753, win 29056, options [nop,nop,TS val 14872465 ecr 450829962], length 1448
15:24:34.300938 IP ankit-XPS-13-9350.localdomain.47190 > bob.localdomain.50000: Flags [.], seq 36200:37648, ack 36201, win 28816, options [nop,nop,TS val 14872465 ecr 450829962], length 1448
15:24:34.300951 IP bob.localdomain.50000 > ankit-XPS-13-9350.localdomain.47190: Flags [.], seq 52129:60817, ack 37648, win 9184, options [nop,nop,TS val 450829963 ecr 14872464], length 8688
15:24:34.301077 IP ankit-XPS-13-9350.localdomain.47190 > bob.localdomain.50000: Flags [.], seq 37648:39096, ack 37649, win 28576, options [nop,nop,TS val 14872465 ecr 450829962], length 1448
15:24:34.301240 IP ankit-XPS-13-9350.localdomain.47190 > bob.localdomain.50000: Flags [.], seq 39096:40544, ack 39097, win 28336, options [nop,nop,TS val 14872465 ecr 450829962], length 1448
15:24:34.301367 IP ankit-XPS-13-9350.localdomain.47190 > bob.localdomain.50000: Flags [.], seq 40544:41992, ack 40545, win 28096, options [nop,nop,TS val 14872465 ecr 450829962], length 1448
15:24:34.301462 IP ankit-XPS-13-9350.localdomain.47190 > bob.localdomain.50000: Flags [.], seq 41992:43440, ack 41993, win 27856, options [nop,nop,TS val 14872465 ecr 450829962], length 1448
15:24:34.301622 IP ankit-XPS-13-9350.localdomain.47190 > bob.localdomain.50000: Flags [.], seq 43440:44888, ack 43441, win 27616, options [nop,nop,TS val 14872465 ecr 450829962], length 1448
15:24:34.301743 IP ankit-XPS-13-9350.localdomain.47190 > bob.localdomain.50000: Flags [.], seq 44888:46336, ack 43441, win 27616, options [nop,nop,TS val 14872465 ecr 450829962], length 1448
15:24:34.301816 IP ankit-XPS-13-9350.localdomain.47190 > bob.localdomain.50000: Flags [.], seq 46336:47784, ack 44889, win 27376, options [nop,nop,TS val 14872465 ecr 450829962], length 1448
15:24:34.301833 IP bob.localdomain.50000 > ankit-XPS-13-9350.localdomain.47190: Flags [.], seq 60817:69505, ack 47784, win 7504, options [nop,nop,TS val 450829963 ecr 14872465], length 8688
15:24:34.301909 IP ankit-XPS-13-9350.localdomain.47190 > bob.localdomain.50000: Flags [.], seq 47784:49232, ack 46337, win 27136, options [nop,nop,TS val 14872465 ecr 450829962], length 1448
15:24:34.302111 IP ankit-XPS-13-9350.localdomain.47190 > bob.localdomain.50000: Flags [.], seq 49232:50680, ack 46337, win 27136, options [nop,nop,TS val 14872465 ecr 450829962], length 1448
15:24:34.302231 IP ankit-XPS-13-9350.localdomain.47190 > bob.localdomain.50000: Flags [.], seq 50680:52128, ack 46337, win 27136, options [nop,nop,TS val 14872465 ecr 450829962], length 1448
15:24:34.302310 IP ankit-XPS-13-9350.localdomain.47190 > bob.localdomain.50000: Flags [.], seq 52128:53576, ack 46337, win 27136, options [nop,nop,TS val 14872465 ecr 450829962], length 1448
15:24:34.302419 IP ankit-XPS-13-9350.localdomain.47190 > bob.localdomain.50000: Flags [.], seq 53576:55024, ack 47785, win 26864, options [nop,nop,TS val 14872465 ecr 450829963], length 1448
15:24:34.302556 IP ankit-XPS-13-9350.localdomain.47190 > bob.localdomain.50000: Flags [.], seq 55024:56472, ack 47785, win 35568, options [nop,nop,TS val 14872465 ecr 450829963], length 1448
15:24:34.302679 IP ankit-XPS-13-9350.localdomain.47190 > bob.localdomain.50000: Flags [.], seq 56472:57920, ack 49233, win 35328, options [nop,nop,TS val 14872465 ecr 450829963], length 1448
15:24:34.302802 IP ankit-XPS-13-9350.localdomain.47190 > bob.localdomain.50000: Flags [.], seq 57920:59368, ack 50681, win 35088, options [nop,nop,TS val 14872465 ecr 450829963], length 1448
15:24:34.302913 IP ankit-XPS-13-9350.localdomain.47190 > bob.localdomain.50000: Flags [.], seq 59368:60816, ack 52129, win 34848, options [nop,nop,TS val 14872465 ecr 450829963], length 1448
15:24:34.302950 IP bob.localdomain.43404 > basswood.localdomain.domain: 12238+ PTR? 134.1.1.10.in-addr.arpa. (41)
15:24:34.303050 IP ankit-XPS-13-9350.localdomain.47190 > bob.localdomain.50000: Flags [.], seq 60816:62264, ack 52129, win 34848, options [nop,nop,TS val 14872465 ecr 450829963], length 1448
15:24:34.303171 IP ankit-XPS-13-9350.localdomain.47190 > bob.localdomain.50000: Flags [P.], seq 62264:63712, ack 52129, win 34848, options [nop,nop,TS val 14872465 ecr 450829963], length 1448
15:24:34.303284 IP basswood.localdomain.domain > bob.localdomain.43404: 12238* 1/0/0 PTR ankit-XPS-13-9350.localdomain. (84)
15:24:34.303297 IP ankit-XPS-13-9350.localdomain.47190 > bob.localdomain.50000: Flags [.], seq 63712:65160, ack 53577, win 34608, options [nop,nop,TS val 14872465 ecr 450829963], length 1448
15:24:34.303311 IP bob.localdomain.50000 > ankit-XPS-13-9350.localdomain.47190: Flags [.], seq 69505:78193, ack 65160, win 4592, options [nop,nop,TS val 450829963 ecr 14872465], length 8688
15:24:34.303331 IP ankit-XPS-13-9350.localdomain.47190 > bob.localdomain.50000: Flags [.], seq 65160:66608, ack 55025, win 34368, options [nop,nop,TS val 14872465 ecr 450829963], length 1448
15:24:34.303461 IP bob.localdomain.56934 > basswood.localdomain.domain: 37290+ PTR? 127.1.1.10.in-addr.arpa. (41)
15:24:34.303546 IP ankit-XPS-13-9350.localdomain.47190 > bob.localdomain.50000: Flags [.], seq 66608:68056, ack 56473, win 34128, options [nop,nop,TS val 14872465 ecr 450829963], length 1448
15:24:34.303666 IP ankit-XPS-13-9350.localdomain.47190 > bob.localdomain.50000: Flags [.], seq 68056:69504, ack 57921, win 33888, options [nop,nop,TS val 14872465 ecr 450829963], length 1448
15:24:34.303777 IP basswood.localdomain.domain > bob.localdomain.56934: 37290* 1/0/0 PTR bob.localdomain. (70)
15:24:34.303785 IP ankit-XPS-13-9350.localdomain.47190 > bob.localdomain.50000: Flags [.], seq 69504:70952, ack 59369, win 33648, options [nop,nop,TS val 14872465 ecr 450829963], length 1448
15:24:34.303912 IP ankit-XPS-13-9350.localdomain.47190 > bob.localdomain.50000: Flags [.], seq 70952:72400, ack 60817, win 33408, options [nop,nop,TS val 14872465 ecr 450829963], length 1448
15:24:34.304035 IP ankit-XPS-13-9350.localdomain.47190 > bob.localdomain.50000: Flags [.], seq 72400:73848, ack 60817, win 33408, options [nop,nop,TS val 14872465 ecr 450829963], length 1448
15:24:34.304144 IP ankit-XPS-13-9350.localdomain.47190 > bob.localdomain.50000: Flags [.], seq 73848:75296, ack 62265, win 33168, options [nop,nop,TS val 14872465 ecr 450829963], length 1448
15:24:34.304156 IP bob.localdomain.50000 > ankit-XPS-13-9350.localdomain.47190: Flags [.], seq 78193:86881, ack 75296, win 2058, options [nop,nop,TS val 450829964 ecr 14872465], length 8688
15:24:34.304286 IP ankit-XPS-13-9350.localdomain.47190 > bob.localdomain.50000: Flags [.], seq 75296:76744, ack 62265, win 33168, options [nop,nop,TS val 14872465 ecr 450829963], length 1448
15:24:34.304406 IP ankit-XPS-13-9350.localdomain.47190 > bob.localdomain.50000: Flags [.], seq 76744:78192, ack 70953, win 31728, options [nop,nop,TS val 14872466 ecr 450829963], length 1448
15:24:34.304422 IP bob.localdomain.50000 > ankit-XPS-13-9350.localdomain.47190: Flags [P.], seq 86881:89777, ack 78192, win 1334, options [nop,nop,TS val 450829964 ecr 14872465], length 2896
15:24:34.304529 IP ankit-XPS-13-9350.localdomain.47190 > bob.localdomain.50000: Flags [.], seq 78192:79640, ack 70953, win 31728, options [nop,nop,TS val 14872466 ecr 450829963], length 1448
15:24:34.304639 IP ankit-XPS-13-9350.localdomain.47190 > bob.localdomain.50000: Flags [.], seq 79640:81088, ack 70953, win 31728, options [nop,nop,TS val 14872466 ecr 450829963], length 1448
15:24:34.304775 IP ankit-XPS-13-9350.localdomain.47190 > bob.localdomain.50000: Flags [.], seq 81088:82536, ack 70953, win 31728, options [nop,nop,TS val 14872466 ecr 450829963], length 1448
15:24:34.315960 IP bob.localdomain.50000 > ankit-XPS-13-9350.localdomain.47190: Flags [P.], seq 88329:89777, ack 82536, win 248, options [nop,nop,TS val 450829967 ecr 14872466], length 1448
15:24:34.316816 IP ankit-XPS-13-9350.localdomain.47190 > bob.localdomain.50000: Flags [.], ack 89777, win 28576, options [nop,nop,TS val 14872469 ecr 450829963,nop,nop,sack 1 {88329:89777}], length 0
15:24:34.316859 IP bob.localdomain.50000 > ankit-XPS-13-9350.localdomain.47190: Flags [P.], seq 89777:93977, ack 82536, win 248, options [nop,nop,TS val 450829967 ecr 14872469], length 4200
15:24:34.317006 IP bob.localdomain.50000 > ankit-XPS-13-9350.localdomain.47190: Flags [.], ack 82536, win 10384, options [nop,nop,TS val 450829967 ecr 14872469], length 0
15:24:34.317283 IP bob.localdomain.50000 > ankit-XPS-13-9350.localdomain.47190: Flags [.], seq 93977:104113, ack 82536, win 10384, options [nop,nop,TS val 450829967 ecr 14872469], length 10136
15:24:34.317290 IP bob.localdomain.50000 > ankit-XPS-13-9350.localdomain.47190: Flags [.], seq 104113:114249, ack 82536, win 10384, options [nop,nop,TS val 450829967 ecr 14872469], length 10136
15:24:34.317397 IP bob.localdomain.50000 > ankit-XPS-13-9350.localdomain.47190: Flags [.], ack 82536, win 23440, options [nop,nop,TS val 450829967 ecr 14872469], length 0
15:24:34.317607 IP ankit-XPS-13-9350.localdomain.47190 > bob.localdomain.50000: Flags [.], ack 91225, win 28336, options [nop,nop,TS val 14872469 ecr 450829967], length 0
15:24:34.317619 IP ankit-XPS-13-9350.localdomain.47190 > bob.localdomain.50000: Flags [.], ack 92673, win 28096, options [nop,nop,TS val 14872469 ecr 450829967], length 0
15:24:34.317834 IP ankit-XPS-13-9350.localdomain.47190 > bob.localdomain.50000: Flags [.], ack 93977, win 27872, options [nop,nop,TS val 14872469 ecr 450829967], length 0
15:24:34.318049 IP ankit-XPS-13-9350.localdomain.47190 > bob.localdomain.50000: Flags [.], seq 82536:83984, ack 93977, win 27872, options [nop,nop,TS val 14872469 ecr 450829967], length 1448
15:24:34.318195 IP ankit-XPS-13-9350.localdomain.47190 > bob.localdomain.50000: Flags [.], seq 83984:85432, ack 93977, win 27872, options [nop,nop,TS val 14872469 ecr 450829967], length 1448
15:24:34.318234 IP ankit-XPS-13-9350.localdomain.47190 > bob.localdomain.50000: Flags [.], seq 85432:86880, ack 93977, win 27872, options [nop,nop,TS val 14872469 ecr 450829967], length 1448
15:24:34.318454 IP ankit-XPS-13-9350.localdomain.47190 > bob.localdomain.50000: Flags [.], seq 86880:88328, ack 93977, win 27872, options [nop,nop,TS val 14872469 ecr 450829967], length 1448
15:24:34.318491 IP ankit-XPS-13-9350.localdomain.47190 > bob.localdomain.50000: Flags [.], seq 88328:89776, ack 93977, win 27872, options [nop,nop,TS val 14872469 ecr 450829967], length 1448
15:24:34.318699 IP ankit-XPS-13-9350.localdomain.47190 > bob.localdomain.50000: Flags [P.], seq 89776:91224, ack 93977, win 27872, options [nop,nop,TS val 14872469 ecr 450829967], length 1448
15:24:34.318720 IP ankit-XPS-13-9350.localdomain.47190 > bob.localdomain.50000: Flags [.], seq 91224:92672, ack 93977, win 27872, options [nop,nop,TS val 14872469 ecr 450829967], length 1448
15:24:34.318951 IP ankit-XPS-13-9350.localdomain.47190 > bob.localdomain.50000: Flags [.], seq 92672:94120, ack 93977, win 27872, options [nop,nop,TS val 14872469 ecr 450829967], length 1448
15:24:34.318980 IP ankit-XPS-13-9350.localdomain.47190 > bob.localdomain.50000: Flags [.], seq 94120:95568, ack 93977, win 27872, options [nop,nop,TS val 14872469 ecr 450829967], length 1448
15:24:34.319196 IP ankit-XPS-13-9350.localdomain.47190 > bob.localdomain.50000: Flags [P.], seq 95568:98464, ack 93977, win 27872, options [nop,nop,TS val 14872469 ecr 450829967], length 2896
15:24:34.319440 IP ankit-XPS-13-9350.localdomain.47190 > bob.localdomain.50000: Flags [.], seq 98464:99912, ack 93977, win 27872, options [nop,nop,TS val 14872469 ecr 450829967], length 1448
15:24:34.319475 IP ankit-XPS-13-9350.localdomain.47190 > bob.localdomain.50000: Flags [.], seq 99912:101360, ack 95425, win 27632, options [nop,nop,TS val 14872469 ecr 450829967], length 1448
15:24:34.319691 IP ankit-XPS-13-9350.localdomain.47190 > bob.localdomain.50000: Flags [.], seq 101360:102808, ack 95425, win 27632, options [nop,nop,TS val 14872469 ecr 450829967], length 1448
15:24:34.319711 IP ankit-XPS-13-9350.localdomain.47190 > bob.localdomain.50000: Flags [.], seq 102808:104256, ack 96873, win 27392, options [nop,nop,TS val 14872469 ecr 450829967], length 1448
15:24:34.319846 IP ankit-XPS-13-9350.localdomain.47190 > bob.localdomain.50000: Flags [.], seq 104256:105704, ack 98321, win 27152, options [nop,nop,TS val 14872469 ecr 450829967], length 1448
15:24:34.319969 IP ankit-XPS-13-9350.localdomain.47190 > bob.localdomain.50000: Flags [P.], seq 105704:107152, ack 99769, win 26880, options [nop,nop,TS val 14872469 ecr 450829967], length 1448
15:24:34.320091 IP ankit-XPS-13-9350.localdomain.47190 > bob.localdomain.50000: Flags [P.], seq 107152:108600, ack 101217, win 26640, options [nop,nop,TS val 14872469 ecr 450829967], length 1448
15:24:34.320201 IP ankit-XPS-13-9350.localdomain.47190 > bob.localdomain.50000: Flags [P.], seq 108600:110048, ack 102665, win 26400, options [nop,nop,TS val 14872469 ecr 450829967], length 1448
15:24:34.320215 IP bob.localdomain.50000 > ankit-XPS-13-9350.localdomain.47190: Flags [.], seq 114249:120041, ack 110048, win 18848, options [nop,nop,TS val 450829968 ecr 14872469], length 5792
15:24:34.320336 IP ankit-XPS-13-9350.localdomain.47190 > bob.localdomain.50000: Flags [P.], seq 110048:111496, ack 102665, win 26400, options [nop,nop,TS val 14872469 ecr 450829967], length 1448
15:24:34.320461 IP ankit-XPS-13-9350.localdomain.47190 > bob.localdomain.50000: Flags [.], seq 111496:112944, ack 105561, win 25920, options [nop,nop,TS val 14872469 ecr 450829967], length 1448
15:24:34.320585 IP ankit-XPS-13-9350.localdomain.47190 > bob.localdomain.50000: Flags [.], seq 112944:114392, ack 107009, win 25680, options [nop,nop,TS val 14872469 ecr 450829967], length 1448
15:24:34.320694 IP ankit-XPS-13-9350.localdomain.47190 > bob.localdomain.50000: Flags [.], seq 114392:115840, ack 108457, win 25440, options [nop,nop,TS val 14872469 ecr 450829967], length 1448
15:24:34.320705 IP bob.localdomain.50000 > ankit-XPS-13-9350.localdomain.47190: Flags [.], seq 120041:125833, ack 115840, win 17888, options [nop,nop,TS val 450829968 ecr 14872469], length 5792
15:24:34.320830 IP ankit-XPS-13-9350.localdomain.47190 > bob.localdomain.50000: Flags [P.], seq 115840:117288, ack 109905, win 25200, options [nop,nop,TS val 14872469 ecr 450829967], length 1448
15:24:34.320911 IP bob.localdomain.40677 > basswood.localdomain.domain: 41815+ PTR? 1.1.1.10.in-addr.arpa. (39)
15:24:34.320943 IP ankit-XPS-13-9350.localdomain.47190 > bob.localdomain.50000: Flags [.], seq 117288:118736, ack 111353, win 24960, options [nop,nop,TS val 14872470 ecr 450829967], length 1448
15:24:34.321076 IP ankit-XPS-13-9350.localdomain.47190 > bob.localdomain.50000: Flags [.], seq 118736:120184, ack 112801, win 24720, options [nop,nop,TS val 14872470 ecr 450829967], length 1448
15:24:34.321187 IP ankit-XPS-13-9350.localdomain.47190 > bob.localdomain.50000: Flags [.], seq 120184:121632, ack 114249, win 24480, options [nop,nop,TS val 14872470 ecr 450829967], length 1448
15:24:34.321199 IP bob.localdomain.50000 > ankit-XPS-13-9350.localdomain.47190: Flags [.], seq 125833:133073, ack 121632, win 16928, options [nop,nop,TS val 450829968 ecr 14872469], length 7240
15:24:34.321324 IP basswood.localdomain.domain > bob.localdomain.40677: 41815* 1/0/0 PTR basswood.localdomain. (73)
15:24:34.321336 IP ankit-XPS-13-9350.localdomain.47190 > bob.localdomain.50000: Flags [.], seq 121632:123080, ack 114249, win 24480, options [nop,nop,TS val 14872470 ecr 450829967], length 1448
15:24:34.321448 IP ankit-XPS-13-9350.localdomain.47190 > bob.localdomain.50000: Flags [.], seq 123080:124528, ack 114249, win 24480, options [nop,nop,TS val 14872470 ecr 450829967], length 1448
15:24:34.321557 IP ankit-XPS-13-9350.localdomain.47190 > bob.localdomain.50000: Flags [.], seq 124528:125976, ack 114249, win 24480, options [nop,nop,TS val 14872470 ecr 450829967], length 1448
15:24:34.321693 IP ankit-XPS-13-9350.localdomain.47190 > bob.localdomain.50000: Flags [.], seq 125976:127424, ack 114249, win 24480, options [nop,nop,TS val 14872470 ecr 450829967], length 1448
15:24:34.321815 IP ankit-XPS-13-9350.localdomain.47190 > bob.localdomain.50000: Flags [.], seq 127424:128872, ack 114249, win 24480, options [nop,nop,TS val 14872470 ecr 450829967], length 1448
15:24:34.321941 IP ankit-XPS-13-9350.localdomain.47190 > bob.localdomain.50000: Flags [.], seq 128872:130320, ack 114249, win 24480, options [nop,nop,TS val 14872470 ecr 450829967], length 1448
15:24:34.322050 IP ankit-XPS-13-9350.localdomain.47190 > bob.localdomain.50000: Flags [.], seq 130320:131768, ack 114249, win 24480, options [nop,nop,TS val 14872470 ecr 450829967], length 1448
15:24:34.322187 IP ankit-XPS-13-9350.localdomain.47190 > bob.localdomain.50000: Flags [.], seq 131768:133216, ack 114249, win 24480, options [nop,nop,TS val 14872470 ecr 450829967], length 1448
15:24:34.322312 IP ankit-XPS-13-9350.localdomain.47190 > bob.localdomain.50000: Flags [.], seq 133216:134664, ack 114249, win 24480, options [nop,nop,TS val 14872470 ecr 450829967], length 1448
15:24:34.322433 IP ankit-XPS-13-9350.localdomain.47190 > bob.localdomain.50000: Flags [P.], seq 134664:136112, ack 114249, win 24480, options [nop,nop,TS val 14872470 ecr 450829967], length 1448
15:24:34.322544 IP ankit-XPS-13-9350.localdomain.47190 > bob.localdomain.50000: Flags [.], seq 136112:137560, ack 115697, win 24240, options [nop,nop,TS val 14872470 ecr 450829968], length 1448
15:24:34.322682 IP ankit-XPS-13-9350.localdomain.47190 > bob.localdomain.50000: Flags [.], seq 137560:139008, ack 115697, win 37296, options [nop,nop,TS val 14872470 ecr 450829968], length 1448
15:24:34.322804 IP ankit-XPS-13-9350.localdomain.47190 > bob.localdomain.50000: Flags [P.], seq 139008:140456, ack 117145, win 37056, options [nop,nop,TS val 14872470 ecr 450829968], length 1448
15:24:34.322928 IP ankit-XPS-13-9350.localdomain.47190 > bob.localdomain.50000: Flags [.], seq 140456:141904, ack 118593, win 36816, options [nop,nop,TS val 14872470 ecr 450829968], length 1448
15:24:34.323038 IP ankit-XPS-13-9350.localdomain.47190 > bob.localdomain.50000: Flags [.], seq 141904:143352, ack 120041, win 36576, options [nop,nop,TS val 14872470 ecr 450829968], length 1448
15:24:34.323173 IP ankit-XPS-13-9350.localdomain.47190 > bob.localdomain.50000: Flags [P.], seq 143352:144800, ack 121489, win 36336, options [nop,nop,TS val 14872470 ecr 450829968], length 1448
15:24:34.323186 IP bob.localdomain.50000 > ankit-XPS-13-9350.localdomain.47190: Flags [.], seq 133073:140313, ack 144800, win 13056, options [nop,nop,TS val 450829968 ecr 14872470], length 7240
15:24:34.323298 IP ankit-XPS-13-9350.localdomain.47190 > bob.localdomain.50000: Flags [.], seq 144800:146248, ack 122937, win 36096, options [nop,nop,TS val 14872470 ecr 450829968], length 1448
15:24:34.323421 IP ankit-XPS-13-9350.localdomain.47190 > bob.localdomain.50000: Flags [.], seq 146248:147696, ack 124385, win 35856, options [nop,nop,TS val 14872470 ecr 450829968], length 1448
15:24:34.323531 IP ankit-XPS-13-9350.localdomain.47190 > bob.localdomain.50000: Flags [.], seq 147696:149144, ack 125833, win 35584, options [nop,nop,TS val 14872470 ecr 450829968], length 1448
15:24:34.323668 IP ankit-XPS-13-9350.localdomain.47190 > bob.localdomain.50000: Flags [.], seq 149144:150592, ack 127281, win 35344, options [nop,nop,TS val 14872470 ecr 450829968], length 1448
15:24:34.323790 IP ankit-XPS-13-9350.localdomain.47190 > bob.localdomain.50000: Flags [P.], seq 150592:152040, ack 127281, win 35344, options [nop,nop,TS val 14872470 ecr 450829968], length 1448
15:24:34.323915 IP ankit-XPS-13-9350.localdomain.47190 > bob.localdomain.50000: Flags [.], seq 152040:153488, ack 128729, win 35104, options [nop,nop,TS val 14872470 ecr 450829968], length 1448
15:24:34.323925 IP bob.localdomain.50000 > ankit-XPS-13-9350.localdomain.47190: Flags [.], seq 140313:147553, ack 153488, win 11616, options [nop,nop,TS val 450829968 ecr 14872470], length 7240
15:24:34.324007 IP ankit-XPS-13-9350.localdomain.47190 > bob.localdomain.50000: Flags [.], seq 153488:154936, ack 130177, win 34864, options [nop,nop,TS val 14872470 ecr 450829968], length 1448
15:24:34.324162 IP ankit-XPS-13-9350.localdomain.47190 > bob.localdomain.50000: Flags [.], seq 154936:156384, ack 131625, win 34624, options [nop,nop,TS val 14872470 ecr 450829968], length 1448
15:24:34.324286 IP ankit-XPS-13-9350.localdomain.47190 > bob.localdomain.50000: Flags [.], seq 156384:157832, ack 133073, win 34384, options [nop,nop,TS val 14872470 ecr 450829968], length 1448
15:24:34.324407 IP ankit-XPS-13-9350.localdomain.47190 > bob.localdomain.50000: Flags [P.], seq 157832:159280, ack 133073, win 34384, options [nop,nop,TS val 14872470 ecr 450829968], length 1448
15:24:34.324517 IP ankit-XPS-13-9350.localdomain.47190 > bob.localdomain.50000: Flags [P.], seq 159280:160728, ack 133073, win 34384, options [nop,nop,TS val 14872470 ecr 450829968], length 1448
15:24:34.324654 IP ankit-XPS-13-9350.localdomain.47190 > bob.localdomain.50000: Flags [P.], seq 160728:162176, ack 133073, win 34384, options [nop,nop,TS val 14872470 ecr 450829968], length 1448
15:24:34.324778 IP ankit-XPS-13-9350.localdomain.47190 > bob.localdomain.50000: Flags [P.], seq 162176:163624, ack 133073, win 34384, options [nop,nop,TS val 14872470 ecr 450829968], length 1448
15:24:34.324901 IP ankit-XPS-13-9350.localdomain.47190 > bob.localdomain.50000: Flags [.], seq 163624:165072, ack 133073, win 34384, options [nop,nop,TS val 14872470 ecr 450829968], length 1448
15:24:34.325011 IP ankit-XPS-13-9350.localdomain.47190 > bob.localdomain.50000: Flags [.], seq 165072:166520, ack 133073, win 34384, options [nop,nop,TS val 14872470 ecr 450829968], length 1448
15:24:34.325147 IP ankit-XPS-13-9350.localdomain.47190 > bob.localdomain.50000: Flags [.], seq 166520:167968, ack 133073, win 34384, options [nop,nop,TS val 14872470 ecr 450829968], length 1448
15:24:34.325272 IP ankit-XPS-13-9350.localdomain.47190 > bob.localdomain.50000: Flags [.], seq 167968:169416, ack 133073, win 34384, options [nop,nop,TS val 14872471 ecr 450829968], length 1448
15:24:34.325395 IP ankit-XPS-13-9350.localdomain.47190 > bob.localdomain.50000: Flags [.], seq 169416:170864, ack 133073, win 34384, options [nop,nop,TS val 14872471 ecr 450829968], length 1448
15:24:34.325505 IP ankit-XPS-13-9350.localdomain.47190 > bob.localdomain.50000: Flags [.], seq 170864:172312, ack 133073, win 34384, options [nop,nop,TS val 14872471 ecr 450829968], length 1448
15:24:34.325642 IP ankit-XPS-13-9350.localdomain.47190 > bob.localdomain.50000: Flags [.], seq 172312:173760, ack 133073, win 34384, options [nop,nop,TS val 14872471 ecr 450829968], length 1448
15:24:34.325765 IP ankit-XPS-13-9350.localdomain.47190 > bob.localdomain.50000: Flags [.], seq 173760:175208, ack 134521, win 34144, options [nop,nop,TS val 14872471 ecr 450829968], length 1448
15:24:34.325887 IP ankit-XPS-13-9350.localdomain.47190 > bob.localdomain.50000: Flags [.], seq 175208:176656, ack 135969, win 33904, options [nop,nop,TS val 14872471 ecr 450829968], length 1448
15:24:34.325899 IP bob.localdomain.50000 > ankit-XPS-13-9350.localdomain.47190: Flags [.], seq 147553:154793, ack 176656, win 7744, options [nop,nop,TS val 450829969 ecr 14872470], length 7240
15:24:34.325990 IP ankit-XPS-13-9350.localdomain.47190 > bob.localdomain.50000: Flags [.], seq 176656:178104, ack 137417, win 33664, options [nop,nop,TS val 14872471 ecr 450829968], length 1448
15:24:34.326135 IP ankit-XPS-13-9350.localdomain.47190 > bob.localdomain.50000: Flags [.], seq 178104:179552, ack 138865, win 33424, options [nop,nop,TS val 14872471 ecr 450829968], length 1448
15:24:34.326258 IP ankit-XPS-13-9350.localdomain.47190 > bob.localdomain.50000: Flags [.], seq 179552:181000, ack 140313, win 33184, options [nop,nop,TS val 14872471 ecr 450829968], length 1448
15:24:34.326383 IP ankit-XPS-13-9350.localdomain.47190 > bob.localdomain.50000: Flags [.], seq 181000:182448, ack 140313, win 33184, options [nop,nop,TS val 14872471 ecr 450829968], length 1448
15:24:34.326491 IP ankit-XPS-13-9350.localdomain.47190 > bob.localdomain.50000: Flags [P.], seq 182448:183896, ack 141761, win 32944, options [nop,nop,TS val 14872471 ecr 450829968], length 1448
15:24:34.326628 IP ankit-XPS-13-9350.localdomain.47190 > bob.localdomain.50000: Flags [.], seq 183896:185344, ack 141761, win 32944, options [nop,nop,TS val 14872471 ecr 450829968], length 1448
15:24:34.326751 IP ankit-XPS-13-9350.localdomain.47190 > bob.localdomain.50000: Flags [.], seq 185344:186792, ack 143209, win 32704, options [nop,nop,TS val 14872471 ecr 450829968], length 1448
15:24:34.326762 IP bob.localdomain.50000 > ankit-XPS-13-9350.localdomain.47190: Flags [.], seq 154793:162033, ack 186792, win 6032, options [nop,nop,TS val 450829969 ecr 14872471], length 7240
15:24:34.326877 IP ankit-XPS-13-9350.localdomain.47190 > bob.localdomain.50000: Flags [.], seq 186792:188240, ack 144657, win 32464, options [nop,nop,TS val 14872471 ecr 450829968], length 1448
15:24:34.326987 IP ankit-XPS-13-9350.localdomain.47190 > bob.localdomain.50000: Flags [.], seq 188240:189688, ack 146105, win 32224, options [nop,nop,TS val 14872471 ecr 450829968], length 1448
15:24:34.327122 IP ankit-XPS-13-9350.localdomain.47190 > bob.localdomain.50000: Flags [.], seq 189688:191136, ack 147553, win 31984, options [nop,nop,TS val 14872471 ecr 450829968], length 1448
15:24:34.327245 IP ankit-XPS-13-9350.localdomain.47190 > bob.localdomain.50000: Flags [.], seq 191136:192584, ack 147553, win 31984, options [nop,nop,TS val 14872471 ecr 450829968], length 1448
15:24:34.327370 IP ankit-XPS-13-9350.localdomain.47190 > bob.localdomain.50000: Flags [.], seq 192584:194032, ack 147553, win 31984, options [nop,nop,TS val 14872471 ecr 450829968], length 1448
15:24:34.327478 IP ankit-XPS-13-9350.localdomain.47190 > bob.localdomain.50000: Flags [P.], seq 194032:195480, ack 147553, win 31984, options [nop,nop,TS val 14872471 ecr 450829968], length 1448
15:24:34.327616 IP ankit-XPS-13-9350.localdomain.47190 > bob.localdomain.50000: Flags [.], seq 195480:196928, ack 147553, win 31984, options [nop,nop,TS val 14872471 ecr 450829968], length 1448
15:24:34.327738 IP ankit-XPS-13-9350.localdomain.47190 > bob.localdomain.50000: Flags [.], seq 196928:198376, ack 147553, win 31984, options [nop,nop,TS val 14872471 ecr 450829968], length 1448
15:24:34.327861 IP ankit-XPS-13-9350.localdomain.47190 > bob.localdomain.50000: Flags [.], seq 198376:199824, ack 147553, win 31984, options [nop,nop,TS val 14872471 ecr 450829968], length 1448
15:24:34.327972 IP ankit-XPS-13-9350.localdomain.47190 > bob.localdomain.50000: Flags [P.], seq 199824:201272, ack 149001, win 31744, options [nop,nop,TS val 14872471 ecr 450829969], length 1448
15:24:34.328117 IP ankit-XPS-13-9350.localdomain.47190 > bob.localdomain.50000: Flags [.], seq 201272:202720, ack 149001, win 31744, options [nop,nop,TS val 14872471 ecr 450829969], length 1448
15:24:34.328271 IP ankit-XPS-13-9350.localdomain.47190 > bob.localdomain.50000: Flags [.], seq 202720:204168, ack 149001, win 31744, options [nop,nop,TS val 14872471 ecr 450829969], length 1448
15:24:34.328402 IP ankit-XPS-13-9350.localdomain.47190 > bob.localdomain.50000: Flags [.], seq 204168:205616, ack 149001, win 31744, options [nop,nop,TS val 14872471 ecr 450829969], length 1448
15:24:34.328499 IP ankit-XPS-13-9350.localdomain.47190 > bob.localdomain.50000: Flags [.], seq 205616:207064, ack 149001, win 31744, options [nop,nop,TS val 14872471 ecr 450829969], length 1448
15:24:34.328512 IP ankit-XPS-13-9350.localdomain.47190 > bob.localdomain.50000: Flags [.], ack 151897, win 39936, options [nop,nop,TS val 14872471 ecr 450829969], length 0
15:24:34.328523 IP bob.localdomain.50000 > ankit-XPS-13-9350.localdomain.47190: Flags [.], seq 162033:170721, ack 207064, win 964, options [nop,nop,TS val 450829970 ecr 14872471], length 8688
15:24:34.328634 IP ankit-XPS-13-9350.localdomain.47190 > bob.localdomain.50000: Flags [.], seq 207064:208512, ack 156241, win 39216, options [nop,nop,TS val 14872472 ecr 450829969], length 1448
15:24:34.328734 IP ankit-XPS-13-9350.localdomain.47190 > bob.localdomain.50000: Flags [.], seq 208512:209960, ack 156241, win 39216, options [nop,nop,TS val 14872472 ecr 450829969], length 1448
15:24:34.367503 IP ankit-XPS-13-9350.localdomain.47190 > bob.localdomain.50000: Flags [.], ack 170721, win 36816, options [nop,nop,TS val 14872482 ecr 450829969], length 0
15:24:34.367516 IP bob.localdomain.50000 > ankit-XPS-13-9350.localdomain.47190: Flags [.], seq 170721:175065, ack 209960, win 240, options [nop,nop,TS val 450829979 ecr 14872472], length 4344
15:24:34.367523 IP bob.localdomain.50000 > ankit-XPS-13-9350.localdomain.47190: Flags [P.], seq 175065:179409, ack 209960, win 240, options [nop,nop,TS val 450829979 ecr 14872472], length 4344
15:24:34.379956 IP bob.localdomain.50000 > ankit-XPS-13-9350.localdomain.47190: Flags [P.], seq 177961:179409, ack 209960, win 240, options [nop,nop,TS val 450829983 ecr 14872472], length 1448
15:24:34.380800 IP ankit-XPS-13-9350.localdomain.47190 > bob.localdomain.50000: Flags [.], ack 179409, win 35344, options [nop,nop,TS val 14872485 ecr 450829979,nop,nop,sack 1 {177961:179409}], length 0
15:24:34.380845 IP bob.localdomain.50000 > ankit-XPS-13-9350.localdomain.47190: Flags [.], seq 179409:183753, ack 209960, win 240, options [nop,nop,TS val 450829983 ecr 14872485], length 4344
15:24:34.380853 IP bob.localdomain.50000 > ankit-XPS-13-9350.localdomain.47190: Flags [.], seq 183753:188097, ack 209960, win 240, options [nop,nop,TS val 450829983 ecr 14872485], length 4344
15:24:34.380858 IP bob.localdomain.50000 > ankit-XPS-13-9350.localdomain.47190: Flags [.], seq 188097:192441, ack 209960, win 240, options [nop,nop,TS val 450829983 ecr 14872485], length 4344
15:24:34.380944 IP bob.localdomain.50000 > ankit-XPS-13-9350.localdomain.47190: Flags [.], seq 192441:196785, ack 209960, win 240, options [nop,nop,TS val 450829983 ecr 14872485], length 4344
15:24:34.380985 IP bob.localdomain.50000 > ankit-XPS-13-9350.localdomain.47190: Flags [.], ack 209960, win 14048, options [nop,nop,TS val 450829983 ecr 14872485], length 0
15:24:34.381244 IP bob.localdomain.50000 > ankit-XPS-13-9350.localdomain.47190: Flags [.], seq 196785:199681, ack 209960, win 14048, options [nop,nop,TS val 450829983 ecr 14872485], length 2896
15:24:34.381940 IP ankit-XPS-13-9350.localdomain.47190 > bob.localdomain.50000: Flags [.], ack 180857, win 35104, options [nop,nop,TS val 14872485 ecr 450829983], length 0
15:24:34.381956 IP ankit-XPS-13-9350.localdomain.47190 > bob.localdomain.50000: Flags [.], ack 180857, win 35104, options [nop,nop,TS val 14872485 ecr 450829983,nop,nop,sack 1 {182305:183753}], length 0
15:24:34.381966 IP ankit-XPS-13-9350.localdomain.47190 > bob.localdomain.50000: Flags [.], ack 183753, win 34624, options [nop,nop,TS val 14872485 ecr 450829983], length 0
15:24:34.381974 IP ankit-XPS-13-9350.localdomain.47190 > bob.localdomain.50000: Flags [.], ack 185201, win 34384, options [nop,nop,TS val 14872485 ecr 450829983], length 0
15:24:34.382128 IP ankit-XPS-13-9350.localdomain.47190 > bob.localdomain.50000: Flags [.], ack 186649, win 34144, options [nop,nop,TS val 14872485 ecr 450829983], length 0
15:24:34.382244 IP ankit-XPS-13-9350.localdomain.47190 > bob.localdomain.50000: Flags [.], ack 188097, win 33904, options [nop,nop,TS val 14872485 ecr 450829983], length 0
15:24:34.382363 IP ankit-XPS-13-9350.localdomain.47190 > bob.localdomain.50000: Flags [.], ack 189545, win 33664, options [nop,nop,TS val 14872485 ecr 450829983], length 0
