15:29:11.338100 IP bob.localdomain.50000 > ankit-XPS-13-9350.localdomain.47256: Flags [.], ack 2568392321, win 6096, options [nop,nop,TS val 450899222 ecr 14941700], length 0
15:29:11.338615 IP bob.localdomain.50000 > ankit-XPS-13-9350.localdomain.47256: Flags [.], seq 0:7240, ack 1, win 6096, options [nop,nop,TS val 450899222 ecr 14941700], length 7240
15:29:11.338620 IP bob.localdomain.50000 > ankit-XPS-13-9350.localdomain.47256: Flags [.], seq 7240:14480, ack 1, win 6096, options [nop,nop,TS val 450899222 ecr 14941700], length 7240
15:29:11.338676 IP bob.localdomain.50000 > ankit-XPS-13-9350.localdomain.47256: Flags [.], ack 1, win 14800, options [nop,nop,TS val 450899222 ecr 14941700], length 0
15:29:11.338909 IP ankit-XPS-13-9350.localdomain.47256 > bob.localdomain.50000: Flags [.], seq 1:1449, ack 0, win 38344, options [nop,nop,TS val 14941723 ecr 450899222], length 1448
15:29:11.339014 IP ankit-XPS-13-9350.localdomain.47256 > bob.localdomain.50000: Flags [.], seq 1449:2897, ack 0, win 38344, options [nop,nop,TS val 14941723 ecr 450899222], length 1448
15:29:11.339150 IP ankit-XPS-13-9350.localdomain.47256 > bob.localdomain.50000: Flags [.], seq 2897:4345, ack 0, win 38344, options [nop,nop,TS val 14941723 ecr 450899222], length 1448
15:29:11.339272 IP ankit-XPS-13-9350.localdomain.47256 > bob.localdomain.50000: Flags [.], seq 4345:5793, ack 0, win 38344, options [nop,nop,TS val 14941723 ecr 450899222], length 1448
15:29:11.339396 IP ankit-XPS-13-9350.localdomain.47256 > bob.localdomain.50000: Flags [.], seq 5793:7241, ack 0, win 38344, options [nop,nop,TS val 14941723 ecr 450899222], length 1448
15:29:11.339506 IP ankit-XPS-13-9350.localdomain.47256 > bob.localdomain.50000: Flags [.], seq 7241:8689, ack 0, win 38344, options [nop,nop,TS val 14941723 ecr 450899222], length 1448
15:29:11.339643 IP ankit-XPS-13-9350.localdomain.47256 > bob.localdomain.50000: Flags [.], seq 8689:10137, ack 0, win 38344, options [nop,nop,TS val 14941723 ecr 450899222], length 1448
15:29:11.339765 IP ankit-XPS-13-9350.localdomain.47256 > bob.localdomain.50000: Flags [.], seq 10137:11585, ack 0, win 38344, options [nop,nop,TS val 14941723 ecr 450899222], length 1448
15:29:11.339889 IP ankit-XPS-13-9350.localdomain.47256 > bob.localdomain.50000: Flags [.], seq 11585:13033, ack 0, win 38344, options [nop,nop,TS val 14941723 ecr 450899222], length 1448
15:29:11.340001 IP ankit-XPS-13-9350.localdomain.47256 > bob.localdomain.50000: Flags [.], seq 13033:14481, ack 0, win 38344, options [nop,nop,TS val 14941723 ecr 450899222], length 1448
15:29:11.340137 IP ankit-XPS-13-9350.localdomain.47256 > bob.localdomain.50000: Flags [.], seq 14481:15929, ack 0, win 38344, options [nop,nop,TS val 14941723 ecr 450899222], length 1448
15:29:11.340261 IP ankit-XPS-13-9350.localdomain.47256 > bob.localdomain.50000: Flags [.], seq 15929:17377, ack 0, win 38344, options [nop,nop,TS val 14941723 ecr 450899222], length 1448
15:29:11.340383 IP ankit-XPS-13-9350.localdomain.47256 > bob.localdomain.50000: Flags [.], seq 17377:18825, ack 0, win 38344, options [nop,nop,TS val 14941723 ecr 450899222], length 1448
15:29:11.340494 IP ankit-XPS-13-9350.localdomain.47256 > bob.localdomain.50000: Flags [.], seq 18825:20273, ack 0, win 38344, options [nop,nop,TS val 14941723 ecr 450899222], length 1448
15:29:11.340497 IP ankit-XPS-13-9350.localdomain.47256 > bob.localdomain.50000: Flags [.], ack 1448, win 38104, options [nop,nop,TS val 14941723 ecr 450899222], length 0
15:29:11.340639 IP ankit-XPS-13-9350.localdomain.47256 > bob.localdomain.50000: Flags [.], seq 20273:21721, ack 2896, win 37864, options [nop,nop,TS val 14941723 ecr 450899222], length 1448
15:29:11.340762 IP ankit-XPS-13-9350.localdomain.47256 > bob.localdomain.50000: Flags [.], seq 21721:23169, ack 4344, win 37624, options [nop,nop,TS val 14941724 ecr 450899222], length 1448
15:29:11.340870 IP ankit-XPS-13-9350.localdomain.47256 > bob.localdomain.50000: Flags [.], seq 23169:24617, ack 14480, win 35944, options [nop,nop,TS val 14941724 ecr 450899222], length 1448
15:29:11.340879 IP bob.localdomain.50000 > ankit-XPS-13-9350.localdomain.47256: Flags [.], seq 14480:21720, ack 24617, win 10688, options [nop,nop,TS val 450899223 ecr 14941723], length 7240
15:29:11.340885 IP bob.localdomain.50000 > ankit-XPS-13-9350.localdomain.47256: Flags [.], seq 21720:28960, ack 24617, win 10688, options [nop,nop,TS val 450899223 ecr 14941723], length 7240
15:29:11.341000 IP ankit-XPS-13-9350.localdomain.47256 > bob.localdomain.50000: Flags [.], seq 24617:26065, ack 14480, win 35944, options [nop,nop,TS val 14941724 ecr 450899222], length 1448
15:29:11.341132 IP ankit-XPS-13-9350.localdomain.47256 > bob.localdomain.50000: Flags [.], seq 26065:27513, ack 14480, win 35944, options [nop,nop,TS val 14941724 ecr 450899222], length 1448
15:29:11.341253 IP ankit-XPS-13-9350.localdomain.47256 > bob.localdomain.50000: Flags [.], seq 27513:28961, ack 14480, win 35944, options [nop,nop,TS val 14941724 ecr 450899222], length 1448
15:29:11.341364 IP ankit-XPS-13-9350.localdomain.47256 > bob.localdomain.50000: Flags [P.], seq 28961:30409, ack 14480, win 35944, options [nop,nop,TS val 14941724 ecr 450899222], length 1448
15:29:11.341500 IP ankit-XPS-13-9350.localdomain.47256 > bob.localdomain.50000: Flags [.], seq 30409:31857, ack 14480, win 35944, options [nop,nop,TS val 14941724 ecr 450899222], length 1448
15:29:11.341626 IP ankit-XPS-13-9350.localdomain.47256 > bob.localdomain.50000: Flags [.], seq 31857:33305, ack 14480, win 35944, options [nop,nop,TS val 14941724 ecr 450899222], length 1448
15:29:11.341747 IP ankit-XPS-13-9350.localdomain.47256 > bob.localdomain.50000: Flags [.], seq 33305:34753, ack 14480, win 35944, options [nop,nop,TS val 14941724 ecr 450899222], length 1448
15:29:11.341857 IP ankit-XPS-13-9350.localdomain.47256 > bob.localdomain.50000: Flags [.], seq 34753:36201, ack 14480, win 35944, options [nop,nop,TS val 14941724 ecr 450899222], length 1448
15:29:11.341993 IP ankit-XPS-13-9350.localdomain.47256 > bob.localdomain.50000: Flags [.], seq 36201:37649, ack 14480, win 35944, options [nop,nop,TS val 14941724 ecr 450899222], length 1448
15:29:11.342117 IP ankit-XPS-13-9350.localdomain.47256 > bob.localdomain.50000: Flags [.], seq 37649:39097, ack 14480, win 35944, options [nop,nop,TS val 14941724 ecr 450899222], length 1448
15:29:11.342240 IP ankit-XPS-13-9350.localdomain.47256 > bob.localdomain.50000: Flags [.], seq 39097:40545, ack 14480, win 35944, options [nop,nop,TS val 14941724 ecr 450899222], length 1448
15:29:11.342351 IP ankit-XPS-13-9350.localdomain.47256 > bob.localdomain.50000: Flags [.], seq 40545:41993, ack 14480, win 35944, options [nop,nop,TS val 14941724 ecr 450899222], length 1448
15:29:11.342488 IP ankit-XPS-13-9350.localdomain.47256 > bob.localdomain.50000: Flags [.], seq 41993:43441, ack 14480, win 35944, options [nop,nop,TS val 14941724 ecr 450899222], length 1448
15:29:11.342610 IP ankit-XPS-13-9350.localdomain.47256 > bob.localdomain.50000: Flags [.], seq 43441:44889, ack 14480, win 35944, options [nop,nop,TS val 14941724 ecr 450899222], length 1448
15:29:11.342734 IP ankit-XPS-13-9350.localdomain.47256 > bob.localdomain.50000: Flags [.], seq 44889:46337, ack 14480, win 35944, options [nop,nop,TS val 14941724 ecr 450899222], length 1448
15:29:11.342845 IP ankit-XPS-13-9350.localdomain.47256 > bob.localdomain.50000: Flags [.], seq 46337:47785, ack 15928, win 35672, options [nop,nop,TS val 14941724 ecr 450899223], length 1448
15:29:11.342982 IP ankit-XPS-13-9350.localdomain.47256 > bob.localdomain.50000: Flags [.], seq 47785:49233, ack 15928, win 35672, options [nop,nop,TS val 14941724 ecr 450899223], length 1448
15:29:11.343104 IP ankit-XPS-13-9350.localdomain.47256 > bob.localdomain.50000: Flags [.], seq 49233:50681, ack 17376, win 35432, options [nop,nop,TS val 14941724 ecr 450899223], length 1448
15:29:11.343229 IP ankit-XPS-13-9350.localdomain.47256 > bob.localdomain.50000: Flags [.], seq 50681:52129, ack 18824, win 35192, options [nop,nop,TS val 14941724 ecr 450899223], length 1448
15:29:11.343235 IP bob.localdomain.50000 > ankit-XPS-13-9350.localdomain.47256: Flags [.], seq 28960:34752, ack 52129, win 6096, options [nop,nop,TS val 450899223 ecr 14941724], length 5792
15:29:11.343319 IP ankit-XPS-13-9350.localdomain.47256 > bob.localdomain.50000: Flags [.], seq 52129:53577, ack 20272, win 34952, options [nop,nop,TS val 14941724 ecr 450899223], length 1448
15:29:11.343475 IP ankit-XPS-13-9350.localdomain.47256 > bob.localdomain.50000: Flags [.], seq 53577:55025, ack 21720, win 34712, options [nop,nop,TS val 14941724 ecr 450899223], length 1448
15:29:11.343598 IP ankit-XPS-13-9350.localdomain.47256 > bob.localdomain.50000: Flags [.], seq 55025:56473, ack 23168, win 34472, options [nop,nop,TS val 14941724 ecr 450899223], length 1448
15:29:11.343722 IP ankit-XPS-13-9350.localdomain.47256 > bob.localdomain.50000: Flags [.], seq 56473:57921, ack 24616, win 34232, options [nop,nop,TS val 14941724 ecr 450899223], length 1448
15:29:11.343728 IP bob.localdomain.50000 > ankit-XPS-13-9350.localdomain.47256: Flags [.], seq 34752:40544, ack 57921, win 5104, options [nop,nop,TS val 450899223 ecr 14941724], length 5792
15:29:11.343814 IP ankit-XPS-13-9350.localdomain.47256 > bob.localdomain.50000: Flags [.], seq 57921:59369, ack 26064, win 33992, options [nop,nop,TS val 14941724 ecr 450899223], length 1448
15:29:11.343969 IP ankit-XPS-13-9350.localdomain.47256 > bob.localdomain.50000: Flags [.], seq 59369:60817, ack 27512, win 33752, options [nop,nop,TS val 14941724 ecr 450899223], length 1448
15:29:11.344091 IP ankit-XPS-13-9350.localdomain.47256 > bob.localdomain.50000: Flags [.], seq 60817:62265, ack 28960, win 33512, options [nop,nop,TS val 14941724 ecr 450899223], length 1448
15:29:11.344215 IP ankit-XPS-13-9350.localdomain.47256 > bob.localdomain.50000: Flags [.], seq 62265:63713, ack 28960, win 33512, options [nop,nop,TS val 14941724 ecr 450899223], length 1448
15:29:11.344325 IP ankit-XPS-13-9350.localdomain.47256 > bob.localdomain.50000: Flags [.], seq 63713:65161, ack 28960, win 33512, options [nop,nop,TS val 14941724 ecr 450899223], length 1448
15:29:11.344462 IP ankit-XPS-13-9350.localdomain.47256 > bob.localdomain.50000: Flags [.], seq 65161:66609, ack 28960, win 33512, options [nop,nop,TS val 14941724 ecr 450899223], length 1448
15:29:11.344585 IP ankit-XPS-13-9350.localdomain.47256 > bob.localdomain.50000: Flags [.], seq 66609:68057, ack 30408, win 33272, options [nop,nop,TS val 14941725 ecr 450899223], length 1448
15:29:11.344592 IP bob.localdomain.50000 > ankit-XPS-13-9350.localdomain.47256: Flags [.], seq 40544:46336, ack 68057, win 3424, options [nop,nop,TS val 450899224 ecr 14941724], length 5792
15:29:11.344709 IP ankit-XPS-13-9350.localdomain.47256 > bob.localdomain.50000: Flags [.], seq 68057:69505, ack 30408, win 33272, options [nop,nop,TS val 14941725 ecr 450899223], length 1448
15:29:11.344819 IP ankit-XPS-13-9350.localdomain.47256 > bob.localdomain.50000: Flags [.], seq 69505:70953, ack 30408, win 33272, options [nop,nop,TS val 14941725 ecr 450899223], length 1448
15:29:11.344956 IP ankit-XPS-13-9350.localdomain.47256 > bob.localdomain.50000: Flags [.], seq 70953:72401, ack 30408, win 33272, options [nop,nop,TS val 14941725 ecr 450899223], length 1448
15:29:11.345078 IP ankit-XPS-13-9350.localdomain.47256 > bob.localdomain.50000: Flags [.], seq 72401:73849, ack 30408, win 33272, options [nop,nop,TS val 14941725 ecr 450899223], length 1448
15:29:11.345189 IP ankit-XPS-13-9350.localdomain.47256 > bob.localdomain.50000: Flags [.], seq 73849:75297, ack 30408, win 33272, options [nop,nop,TS val 14941725 ecr 450899223], length 1448
15:29:11.345197 IP ankit-XPS-13-9350.localdomain.47256 > bob.localdomain.50000: Flags [.], ack 33304, win 37136, options [nop,nop,TS val 14941725 ecr 450899223], length 0
15:29:11.345334 IP ankit-XPS-13-9350.localdomain.47256 > bob.localdomain.50000: Flags [.], seq 75297:76745, ack 36200, win 36656, options [nop,nop,TS val 14941725 ecr 450899223], length 1448
15:29:11.345346 IP bob.localdomain.50000 > ankit-XPS-13-9350.localdomain.47256: Flags [.], seq 46336:52128, ack 76745, win 1252, options [nop,nop,TS val 450899224 ecr 14941725], length 5792
15:29:11.345457 IP ankit-XPS-13-9350.localdomain.47256 > bob.localdomain.50000: Flags [.], seq 76745:78193, ack 36200, win 36656, options [nop,nop,TS val 14941725 ecr 450899223], length 1448
15:29:11.345580 IP ankit-XPS-13-9350.localdomain.47256 > bob.localdomain.50000: Flags [.], seq 78193:79641, ack 41992, win 35664, options [nop,nop,TS val 14941725 ecr 450899223], length 1448
15:29:11.345591 IP bob.localdomain.50000 > ankit-XPS-13-9350.localdomain.47256: Flags [.], seq 52128:57920, ack 79641, win 528, options [nop,nop,TS val 450899224 ecr 14941725], length 5792
15:29:11.345664 IP bob.localdomain.56843 > basswood.localdomain.domain: 57190+ PTR? 134.1.1.10.in-addr.arpa. (41)
15:29:11.345672 IP ankit-XPS-13-9350.localdomain.47256 > bob.localdomain.50000: Flags [.], seq 79641:81089, ack 41992, win 35664, options [nop,nop,TS val 14941725 ecr 450899223], length 1448
15:29:11.346118 IP basswood.localdomain.domain > bob.localdomain.56843: 57190* 1/0/0 PTR ankit-XPS-13-9350.localdomain. (84)
15:29:11.346129 IP ankit-XPS-13-9350.localdomain.47256 > bob.localdomain.50000: Flags [.], ack 47784, win 43408, options [nop,nop,TS val 14941725 ecr 450899224], length 0
15:29:11.346145 IP bob.localdomain.50000 > ankit-XPS-13-9350.localdomain.47256: Flags [.], seq 57920:63712, ack 81089, win 166, options [nop,nop,TS val 450899224 ecr 14941725], length 5792
15:29:11.346336 IP bob.localdomain.34087 > basswood.localdomain.domain: 32165+ PTR? 127.1.1.10.in-addr.arpa. (41)
15:29:11.346717 IP basswood.localdomain.domain > bob.localdomain.34087: 32165* 1/0/0 PTR bob.localdomain. (70)
15:29:11.355952 IP bob.localdomain.50000 > ankit-XPS-13-9350.localdomain.47256: Flags [P.], seq 63712:64400, ack 81089, win 166, options [nop,nop,TS val 450899227 ecr 14941725], length 688
15:29:11.383574 IP ankit-XPS-13-9350.localdomain.47256 > bob.localdomain.50000: Flags [.], ack 64400, win 40624, options [nop,nop,TS val 14941735 ecr 450899224], length 0
15:29:11.460649 IP bob.localdomain.50000 > ankit-XPS-13-9350.localdomain.47256: Flags [.], seq 64400:68744, ack 81089, win 166, options [nop,nop,TS val 450899253 ecr 14941735], length 4344
15:29:11.460654 IP bob.localdomain.50000 > ankit-XPS-13-9350.localdomain.47256: Flags [.], seq 68744:73088, ack 81089, win 166, options [nop,nop,TS val 450899253 ecr 14941735], length 4344
15:29:11.460656 IP bob.localdomain.50000 > ankit-XPS-13-9350.localdomain.47256: Flags [.], seq 73088:77432, ack 81089, win 166, options [nop,nop,TS val 450899253 ecr 14941735], length 4344
15:29:11.460760 IP bob.localdomain.50000 > ankit-XPS-13-9350.localdomain.47256: Flags [.], ack 81089, win 9968, options [nop,nop,TS val 450899253 ecr 14941735], length 0
15:29:11.460763 IP bob.localdomain.50000 > ankit-XPS-13-9350.localdomain.47256: Flags [.], seq 77432:81776, ack 81089, win 9968, options [nop,nop,TS val 450899253 ecr 14941735], length 4344
15:29:11.461668 IP ankit-XPS-13-9350.localdomain.47256 > bob.localdomain.50000: Flags [.], ack 64400, win 40624, options [nop,nop,TS val 14941754 ecr 450899224,nop,nop,sack 1 {67296:68744}], length 0
15:29:11.461681 IP bob.localdomain.50000 > ankit-XPS-13-9350.localdomain.47256: Flags [.], seq 81776:84672, ack 81089, win 9968, options [nop,nop,TS val 450899253 ecr 14941754], length 2896
15:29:11.461686 IP ankit-XPS-13-9350.localdomain.47256 > bob.localdomain.50000: Flags [.], ack 65848, win 40262, options [nop,nop,TS val 14941754 ecr 450899253,nop,nop,sack 1 {67296:68744}], length 0
15:29:11.461692 IP bob.localdomain.50000 > ankit-XPS-13-9350.localdomain.47256: Flags [.], seq 84672:86120, ack 81089, win 9968, options [nop,nop,TS val 450899253 ecr 14941754], length 1448
15:29:11.461735 IP ankit-XPS-13-9350.localdomain.47256 > bob.localdomain.50000: Flags [.], ack 65848, win 40262, options [nop,nop,TS val 14941754 ecr 450899253,nop,nop,sack 1 {67296:70192}], length 0
15:29:11.461742 IP bob.localdomain.50000 > ankit-XPS-13-9350.localdomain.47256: Flags [.], seq 86120:87568, ack 81089, win 9968, options [nop,nop,TS val 450899253 ecr 14941754], length 1448
15:29:11.461745 IP ankit-XPS-13-9350.localdomain.47256 > bob.localdomain.50000: Flags [.], ack 70192, win 39632, options [nop,nop,TS val 14941754 ecr 450899253], length 0
15:29:11.462000 IP ankit-XPS-13-9350.localdomain.47256 > bob.localdomain.50000: Flags [.], ack 71640, win 39392, options [nop,nop,TS val 14941754 ecr 450899253], length 0
15:29:11.462004 IP ankit-XPS-13-9350.localdomain.47256 > bob.localdomain.50000: Flags [.], ack 73088, win 39152, options [nop,nop,TS val 14941754 ecr 450899253], length 0
15:29:11.462162 IP ankit-XPS-13-9350.localdomain.47256 > bob.localdomain.50000: Flags [.], ack 74536, win 38912, options [nop,nop,TS val 14941754 ecr 450899253], length 0
15:29:11.462167 IP ankit-XPS-13-9350.localdomain.47256 > bob.localdomain.50000: Flags [.], ack 75984, win 38672, options [nop,nop,TS val 14941754 ecr 450899253], length 0
15:29:11.462171 IP bob.localdomain.50000 > ankit-XPS-13-9350.localdomain.47256: Flags [.], seq 87568:94808, ack 81089, win 9968, options [nop,nop,TS val 450899253 ecr 14941754], length 7240
15:29:11.462489 IP ankit-XPS-13-9350.localdomain.47256 > bob.localdomain.50000: Flags [.], ack 77432, win 38432, options [nop,nop,TS val 14941754 ecr 450899253], length 0
15:29:11.462736 IP ankit-XPS-13-9350.localdomain.47256 > bob.localdomain.50000: Flags [.], seq 81089:82537, ack 78880, win 38192, options [nop,nop,TS val 14941754 ecr 450899253], length 1448
15:29:11.462859 IP ankit-XPS-13-9350.localdomain.47256 > bob.localdomain.50000: Flags [.], seq 82537:83985, ack 78880, win 38192, options [nop,nop,TS val 14941754 ecr 450899253], length 1448
15:29:11.462970 IP ankit-XPS-13-9350.localdomain.47256 > bob.localdomain.50000: Flags [.], seq 83985:85433, ack 78880, win 38192, options [nop,nop,TS val 14941754 ecr 450899253], length 1448
15:29:11.463105 IP ankit-XPS-13-9350.localdomain.47256 > bob.localdomain.50000: Flags [P.], seq 85433:86881, ack 78880, win 38192, options [nop,nop,TS val 14941754 ecr 450899253], length 1448
15:29:11.463228 IP ankit-XPS-13-9350.localdomain.47256 > bob.localdomain.50000: Flags [.], seq 86881:88329, ack 78880, win 38192, options [nop,nop,TS val 14941754 ecr 450899253], length 1448
15:29:11.463352 IP ankit-XPS-13-9350.localdomain.47256 > bob.localdomain.50000: Flags [.], seq 88329:89777, ack 78880, win 38192, options [nop,nop,TS val 14941754 ecr 450899253], length 1448
15:29:11.463462 IP ankit-XPS-13-9350.localdomain.47256 > bob.localdomain.50000: Flags [.], seq 89777:91225, ack 78880, win 38192, options [nop,nop,TS val 14941754 ecr 450899253], length 1448
15:29:11.463599 IP ankit-XPS-13-9350.localdomain.47256 > bob.localdomain.50000: Flags [.], seq 91225:92673, ack 78880, win 38192, options [nop,nop,TS val 14941754 ecr 450899253], length 1448
15:29:11.463602 IP ankit-XPS-13-9350.localdomain.47256 > bob.localdomain.50000: Flags [.], ack 78880, win 38192, options [nop,nop,TS val 14941754 ecr 450899253], length 0
15:29:11.463729 IP ankit-XPS-13-9350.localdomain.47256 > bob.localdomain.50000: Flags [.], seq 92673:94121, ack 80328, win 37952, options [nop,nop,TS val 14941754 ecr 450899253], length 1448
15:29:11.463840 IP ankit-XPS-13-9350.localdomain.47256 > bob.localdomain.50000: Flags [.], seq 94121:95569, ack 80328, win 37952, options [nop,nop,TS val 14941754 ecr 450899253], length 1448
15:29:11.463977 IP ankit-XPS-13-9350.localdomain.47256 > bob.localdomain.50000: Flags [.], seq 95569:97017, ack 80328, win 37952, options [nop,nop,TS val 14941754 ecr 450899253], length 1448
15:29:11.464099 IP ankit-XPS-13-9350.localdomain.47256 > bob.localdomain.50000: Flags [.], seq 97017:98465, ack 80328, win 37952, options [nop,nop,TS val 14941754 ecr 450899253], length 1448
15:29:11.464222 IP ankit-XPS-13-9350.localdomain.47256 > bob.localdomain.50000: Flags [.], seq 98465:99913, ack 81776, win 37712, options [nop,nop,TS val 14941754 ecr 450899253], length 1448
15:29:11.464333 IP ankit-XPS-13-9350.localdomain.47256 > bob.localdomain.50000: Flags [.], seq 99913:101361, ack 81776, win 37712, options [nop,nop,TS val 14941754 ecr 450899253], length 1448
15:29:11.464469 IP ankit-XPS-13-9350.localdomain.47256 > bob.localdomain.50000: Flags [.], seq 101361:102809, ack 83224, win 37472, options [nop,nop,TS val 14941754 ecr 450899253], length 1448
15:29:11.464476 IP bob.localdomain.50000 > ankit-XPS-13-9350.localdomain.47256: Flags [.], seq 94808:102048, ack 102809, win 6336, options [nop,nop,TS val 450899254 ecr 14941754], length 7240
15:29:11.464594 IP ankit-XPS-13-9350.localdomain.47256 > bob.localdomain.50000: Flags [.], seq 102809:104257, ack 84672, win 37232, options [nop,nop,TS val 14941754 ecr 450899253], length 1448
15:29:11.464716 IP ankit-XPS-13-9350.localdomain.47256 > bob.localdomain.50000: Flags [.], seq 104257:105705, ack 86120, win 36992, options [nop,nop,TS val 14941754 ecr 450899253], length 1448
15:29:11.464827 IP ankit-XPS-13-9350.localdomain.47256 > bob.localdomain.50000: Flags [.], seq 105705:107153, ack 87568, win 36752, options [nop,nop,TS val 14941754 ecr 450899253], length 1448
15:29:11.464963 IP ankit-XPS-13-9350.localdomain.47256 > bob.localdomain.50000: Flags [.], seq 107153:108601, ack 89016, win 36512, options [nop,nop,TS val 14941754 ecr 450899253], length 1448
15:29:11.465086 IP ankit-XPS-13-9350.localdomain.47256 > bob.localdomain.50000: Flags [.], seq 108601:110049, ack 90464, win 36272, options [nop,nop,TS val 14941755 ecr 450899253], length 1448
15:29:11.465092 IP bob.localdomain.50000 > ankit-XPS-13-9350.localdomain.47256: Flags [.], seq 102048:109288, ack 110049, win 5104, options [nop,nop,TS val 450899254 ecr 14941754], length 7240
15:29:11.465210 IP ankit-XPS-13-9350.localdomain.47256 > bob.localdomain.50000: Flags [.], seq 110049:111497, ack 91912, win 36032, options [nop,nop,TS val 14941755 ecr 450899253], length 1448
15:29:11.465320 IP ankit-XPS-13-9350.localdomain.47256 > bob.localdomain.50000: Flags [.], seq 111497:112945, ack 94808, win 35520, options [nop,nop,TS val 14941755 ecr 450899253], length 1448
15:29:11.465457 IP ankit-XPS-13-9350.localdomain.47256 > bob.localdomain.50000: Flags [.], seq 112945:114393, ack 94808, win 35520, options [nop,nop,TS val 14941755 ecr 450899253], length 1448
15:29:11.465579 IP ankit-XPS-13-9350.localdomain.47256 > bob.localdomain.50000: Flags [.], seq 114393:115841, ack 94808, win 35520, options [nop,nop,TS val 14941755 ecr 450899253], length 1448
15:29:11.465703 IP ankit-XPS-13-9350.localdomain.47256 > bob.localdomain.50000: Flags [.], seq 115841:117289, ack 94808, win 35520, options [nop,nop,TS val 14941755 ecr 450899253], length 1448
15:29:11.465813 IP ankit-XPS-13-9350.localdomain.47256 > bob.localdomain.50000: Flags [.], seq 117289:118737, ack 94808, win 35520, options [nop,nop,TS val 14941755 ecr 450899253], length 1448
15:29:11.465950 IP ankit-XPS-13-9350.localdomain.47256 > bob.localdomain.50000: Flags [.], seq 118737:120185, ack 94808, win 35520, options [nop,nop,TS val 14941755 ecr 450899253], length 1448
15:29:11.466074 IP ankit-XPS-13-9350.localdomain.47256 > bob.localdomain.50000: Flags [.], seq 120185:121633, ack 96256, win 35280, options [nop,nop,TS val 14941755 ecr 450899254], length 1448
15:29:11.466196 IP ankit-XPS-13-9350.localdomain.47256 > bob.localdomain.50000: Flags [.], seq 121633:123081, ack 96256, win 35280, options [nop,nop,TS val 14941755 ecr 450899254], length 1448
15:29:11.466307 IP ankit-XPS-13-9350.localdomain.47256 > bob.localdomain.50000: Flags [.], seq 123081:124529, ack 96256, win 35280, options [nop,nop,TS val 14941755 ecr 450899254], length 1448
15:29:11.466443 IP ankit-XPS-13-9350.localdomain.47256 > bob.localdomain.50000: Flags [.], seq 124529:125977, ack 96256, win 35280, options [nop,nop,TS val 14941755 ecr 450899254], length 1448
15:29:11.466567 IP ankit-XPS-13-9350.localdomain.47256 > bob.localdomain.50000: Flags [.], seq 125977:127425, ack 96256, win 35280, options [nop,nop,TS val 14941755 ecr 450899254], length 1448
15:29:11.466570 IP ankit-XPS-13-9350.localdomain.47256 > bob.localdomain.50000: Flags [.], ack 99152, win 34800, options [nop,nop,TS val 14941755 ecr 450899254], length 0
15:29:11.466576 IP bob.localdomain.50000 > ankit-XPS-13-9350.localdomain.47256: Flags [.], seq 109288:117976, ack 127425, win 760, options [nop,nop,TS val 450899254 ecr 14941755], length 8688
15:29:11.466666 IP ankit-XPS-13-9350.localdomain.47256 > bob.localdomain.50000: Flags [.], seq 127425:128873, ack 103496, win 34080, options [nop,nop,TS val 14941755 ecr 450899254], length 1448
15:29:11.466730 IP bob.localdomain.43740 > basswood.localdomain.domain: 46522+ PTR? 1.1.1.10.in-addr.arpa. (39)
15:29:11.466823 IP ankit-XPS-13-9350.localdomain.47256 > bob.localdomain.50000: Flags [.], seq 128873:130321, ack 103496, win 34080, options [nop,nop,TS val 14941755 ecr 450899254], length 1448
15:29:11.467067 IP basswood.localdomain.domain > bob.localdomain.43740: 46522* 1/0/0 PTR basswood.localdomain. (73)
15:29:11.468170 IP ankit-XPS-13-9350.localdomain.47256 > bob.localdomain.50000: Flags [.], ack 117976, win 40288, options [nop,nop,TS val 14941756 ecr 450899254], length 0
15:29:11.468179 IP bob.localdomain.50000 > ankit-XPS-13-9350.localdomain.47256: Flags [.], seq 117976:126664, ack 130321, win 36, options [nop,nop,TS val 450899255 ecr 14941755], length 8688
15:29:11.468185 IP bob.localdomain.50000 > ankit-XPS-13-9350.localdomain.47256: Flags [P.], seq 126664:128800, ack 130321, win 36, options [nop,nop,TS val 450899255 ecr 14941755], length 2136
15:29:11.479952 IP bob.localdomain.50000 > ankit-XPS-13-9350.localdomain.47256: Flags [P.], seq 128112:128800, ack 130321, win 36, options [nop,nop,TS val 450899258 ecr 14941755], length 688
15:29:11.480569 IP ankit-XPS-13-9350.localdomain.47256 > bob.localdomain.50000: Flags [.], ack 128800, win 38432, options [nop,nop,TS val 14941759 ecr 450899255,nop,nop,sack 1 {128112:128800}], length 0
15:29:11.534440 IP bob.localdomain.50000 > ankit-XPS-13-9350.localdomain.47256: Flags [.], ack 130321, win 6096, options [nop,nop,TS val 450899271 ecr 14941759], length 0
15:29:11.535447 IP ankit-XPS-13-9350.localdomain.47256 > bob.localdomain.50000: Flags [.], seq 130321:131769, ack 128800, win 38432, options [nop,nop,TS val 14941772 ecr 450899271], length 1448
15:29:11.535568 IP ankit-XPS-13-9350.localdomain.47256 > bob.localdomain.50000: Flags [.], seq 131769:133217, ack 128800, win 38432, options [nop,nop,TS val 14941772 ecr 450899271], length 1448
15:29:11.535693 IP ankit-XPS-13-9350.localdomain.47256 > bob.localdomain.50000: Flags [.], seq 133217:134665, ack 128800, win 38432, options [nop,nop,TS val 14941772 ecr 450899271], length 1448
15:29:11.535803 IP ankit-XPS-13-9350.localdomain.47256 > bob.localdomain.50000: Flags [.], seq 134665:136113, ack 128800, win 38432, options [nop,nop,TS val 14941772 ecr 450899271], length 1448
15:29:11.535938 IP ankit-XPS-13-9350.localdomain.47256 > bob.localdomain.50000: Flags [.], seq 136113:137561, ack 128800, win 38432, options [nop,nop,TS val 14941772 ecr 450899271], length 1448
15:29:11.536062 IP ankit-XPS-13-9350.localdomain.47256 > bob.localdomain.50000: Flags [.], seq 137561:139009, ack 128800, win 38432, options [nop,nop,TS val 14941772 ecr 450899271], length 1448
15:29:11.536244 IP ankit-XPS-13-9350.localdomain.47256 > bob.localdomain.50000: Flags [.], seq 139009:140457, ack 128800, win 38432, options [nop,nop,TS val 14941772 ecr 450899271], length 1448
15:29:11.536307 IP ankit-XPS-13-9350.localdomain.47256 > bob.localdomain.50000: Flags [.], seq 140457:141905, ack 128800, win 38432, options [nop,nop,TS val 14941772 ecr 450899271], length 1448
15:29:11.536492 IP ankit-XPS-13-9350.localdomain.47256 > bob.localdomain.50000: Flags [.], seq 141905:143353, ack 128800, win 38432, options [nop,nop,TS val 14941772 ecr 450899271], length 1448
15:29:11.536562 IP ankit-XPS-13-9350.localdomain.47256 > bob.localdomain.50000: Flags [.], seq 143353:144801, ack 128800, win 38432, options [nop,nop,TS val 14941772 ecr 450899271], length 1448
15:29:11.536742 IP ankit-XPS-13-9350.localdomain.47256 > bob.localdomain.50000: Flags [.], seq 144801:146249, ack 128800, win 38432, options [nop,nop,TS val 14941772 ecr 450899271], length 1448
15:29:11.536802 IP ankit-XPS-13-9350.localdomain.47256 > bob.localdomain.50000: Flags [.], seq 146249:147697, ack 128800, win 38432, options [nop,nop,TS val 14941772 ecr 450899271], length 1448
15:29:11.536913 IP bob.localdomain.50000 > ankit-XPS-13-9350.localdomain.47256: Flags [.], seq 128800:137488, ack 147697, win 1752, options [nop,nop,TS val 450899272 ecr 14941772], length 8688
15:29:11.536917 IP bob.localdomain.50000 > ankit-XPS-13-9350.localdomain.47256: Flags [.], seq 137488:146176, ack 147697, win 1752, options [nop,nop,TS val 450899272 ecr 14941772], length 8688
15:29:11.536928 IP ankit-XPS-13-9350.localdomain.47256 > bob.localdomain.50000: Flags [.], seq 147697:149145, ack 128800, win 38432, options [nop,nop,TS val 14941772 ecr 450899271], length 1448
15:29:11.537052 IP ankit-XPS-13-9350.localdomain.47256 > bob.localdomain.50000: Flags [.], seq 149145:150593, ack 128800, win 38432, options [nop,nop,TS val 14941772 ecr 450899271], length 1448
15:29:11.537056 IP bob.localdomain.50000 > ankit-XPS-13-9350.localdomain.47256: Flags [.], ack 149145, win 11648, options [nop,nop,TS val 450899272 ecr 14941772], length 0
15:29:11.537175 IP ankit-XPS-13-9350.localdomain.47256 > bob.localdomain.50000: Flags [.], seq 150593:152041, ack 128800, win 38432, options [nop,nop,TS val 14941773 ecr 450899271], length 1448
15:29:11.537265 IP ankit-XPS-13-9350.localdomain.47256 > bob.localdomain.50000: Flags [.], seq 152041:153489, ack 128800, win 38432, options [nop,nop,TS val 14941773 ecr 450899271], length 1448
15:29:11.539522 IP ankit-XPS-13-9350.localdomain.47256 > bob.localdomain.50000: Flags [.], seq 153489:156385, ack 146176, win 35520, options [nop,nop,TS val 14941773 ecr 450899272], length 2896
15:29:11.539533 IP bob.localdomain.50000 > ankit-XPS-13-9350.localdomain.47256: Flags [.], seq 146176:151968, ack 156385, win 10448, options [nop,nop,TS val 450899272 ecr 14941772], length 5792
15:29:11.539538 IP bob.localdomain.50000 > ankit-XPS-13-9350.localdomain.47256: Flags [.], seq 151968:157760, ack 156385, win 10448, options [nop,nop,TS val 450899272 ecr 14941772], length 5792
15:29:11.539771 IP ankit-XPS-13-9350.localdomain.47256 > bob.localdomain.50000: Flags [.], seq 156385:159281, ack 146176, win 35520, options [nop,nop,TS val 14941773 ecr 450899272], length 2896
15:29:11.540020 IP ankit-XPS-13-9350.localdomain.47256 > bob.localdomain.50000: Flags [P.], seq 159281:162177, ack 146176, win 35520, options [nop,nop,TS val 14941773 ecr 450899272], length 2896
15:29:11.540268 IP ankit-XPS-13-9350.localdomain.47256 > bob.localdomain.50000: Flags [P.], seq 162177:163625, ack 146176, win 35520, options [nop,nop,TS val 14941773 ecr 450899272], length 1448
15:29:11.540273 IP ankit-XPS-13-9350.localdomain.47256 > bob.localdomain.50000: Flags [.], seq 163625:165073, ack 146176, win 35520, options [nop,nop,TS val 14941773 ecr 450899272], length 1448
15:29:11.540520 IP ankit-XPS-13-9350.localdomain.47256 > bob.localdomain.50000: Flags [.], seq 165073:167969, ack 146176, win 35520, options [nop,nop,TS val 14941773 ecr 450899272], length 2896
15:29:11.540771 IP ankit-XPS-13-9350.localdomain.47256 > bob.localdomain.50000: Flags [.], seq 167969:170865, ack 146176, win 35520, options [nop,nop,TS val 14941773 ecr 450899272], length 2896
15:29:11.541019 IP ankit-XPS-13-9350.localdomain.47256 > bob.localdomain.50000: Flags [.], seq 170865:173761, ack 146176, win 35520, options [nop,nop,TS val 14941773 ecr 450899272], length 2896
15:29:11.541268 IP ankit-XPS-13-9350.localdomain.47256 > bob.localdomain.50000: Flags [.], seq 173761:175209, ack 146176, win 35520, options [nop,nop,TS val 14941773 ecr 450899272], length 1448
15:29:11.541272 IP ankit-XPS-13-9350.localdomain.47256 > bob.localdomain.50000: Flags [.], seq 175209:176657, ack 146176, win 35520, options [nop,nop,TS val 14941774 ecr 450899272], length 1448
15:29:11.541519 IP ankit-XPS-13-9350.localdomain.47256 > bob.localdomain.50000: Flags [.], seq 176657:179553, ack 146176, win 35520, options [nop,nop,TS val 14941774 ecr 450899272], length 2896
15:29:11.541769 IP ankit-XPS-13-9350.localdomain.47256 > bob.localdomain.50000: Flags [.], seq 179553:182449, ack 146176, win 35520, options [nop,nop,TS val 14941774 ecr 450899272], length 2896
15:29:11.542019 IP ankit-XPS-13-9350.localdomain.47256 > bob.localdomain.50000: Flags [.], seq 182449:185345, ack 146176, win 35520, options [nop,nop,TS val 14941774 ecr 450899272], length 2896
15:29:11.542267 IP ankit-XPS-13-9350.localdomain.47256 > bob.localdomain.50000: Flags [.], seq 185345:186793, ack 149072, win 35040, options [nop,nop,TS val 14941774 ecr 450899272], length 1448
15:29:11.542276 IP bob.localdomain.50000 > ankit-XPS-13-9350.localdomain.47256: Flags [.], seq 157760:163552, ack 186793, win 5344, options [nop,nop,TS val 450899273 ecr 14941773], length 5792
15:29:11.542282 IP ankit-XPS-13-9350.localdomain.47256 > bob.localdomain.50000: Flags [.], seq 186793:188241, ack 151968, win 34560, options [nop,nop,TS val 14941774 ecr 450899272], length 1448
15:29:11.542518 IP ankit-XPS-13-9350.localdomain.47256 > bob.localdomain.50000: Flags [.], seq 188241:189689, ack 151968, win 34560, options [nop,nop,TS val 14941774 ecr 450899272], length 1448
15:29:11.542522 IP ankit-XPS-13-9350.localdomain.47256 > bob.localdomain.50000: Flags [.], seq 189689:191137, ack 154864, win 34080, options [nop,nop,TS val 14941774 ecr 450899272], length 1448
15:29:11.542529 IP bob.localdomain.50000 > ankit-XPS-13-9350.localdomain.47256: Flags [.], seq 163552:169344, ack 191137, win 4624, options [nop,nop,TS val 450899273 ecr 14941774], length 5792
15:29:11.542767 IP ankit-XPS-13-9350.localdomain.47256 > bob.localdomain.50000: Flags [.], seq 191137:192585, ack 154864, win 34080, options [nop,nop,TS val 14941774 ecr 450899272], length 1448
15:29:11.542774 IP ankit-XPS-13-9350.localdomain.47256 > bob.localdomain.50000: Flags [.], seq 192585:194033, ack 157760, win 33600, options [nop,nop,TS val 14941774 ecr 450899272], length 1448
15:29:11.543021 IP ankit-XPS-13-9350.localdomain.47256 > bob.localdomain.50000: Flags [.], seq 194033:196929, ack 157760, win 33600, options [nop,nop,TS val 14941774 ecr 450899272], length 2896
15:29:11.543525 IP ankit-XPS-13-9350.localdomain.47256 > bob.localdomain.50000: Flags [.], seq 196929:199825, ack 159208, win 33360, options [nop,nop,TS val 14941774 ecr 450899273], length 2896
15:29:11.543776 IP ankit-XPS-13-9350.localdomain.47256 > bob.localdomain.50000: Flags [.], seq 199825:202721, ack 159208, win 33360, options [nop,nop,TS val 14941774 ecr 450899273], length 2896
15:29:11.544026 IP ankit-XPS-13-9350.localdomain.47256 > bob.localdomain.50000: Flags [.], seq 202721:205617, ack 159208, win 33360, options [nop,nop,TS val 14941774 ecr 450899273], length 2896
15:29:11.544274 IP ankit-XPS-13-9350.localdomain.47256 > bob.localdomain.50000: Flags [.], seq 205617:207065, ack 159208, win 33360, options [nop,nop,TS val 14941774 ecr 450899273], length 1448
15:29:11.544278 IP ankit-XPS-13-9350.localdomain.47256 > bob.localdomain.50000: Flags [.], ack 162104, win 32880, options [nop,nop,TS val 14941774 ecr 450899273], length 0
15:29:11.544285 IP bob.localdomain.50000 > ankit-XPS-13-9350.localdomain.47256: Flags [.], seq 169344:176584, ack 207065, win 642, options [nop,nop,TS val 450899274 ecr 14941774], length 7240
15:29:11.544291 IP ankit-XPS-13-9350.localdomain.47256 > bob.localdomain.50000: Flags [.], seq 207065:208513, ack 165000, win 36656, options [nop,nop,TS val 14941775 ecr 450899273], length 1448
15:29:11.546059 IP ankit-XPS-13-9350.localdomain.47256 > bob.localdomain.50000: Flags [.], ack 176584, win 43408, options [nop,nop,TS val 14941775 ecr 450899273], length 0
15:29:11.546065 IP bob.localdomain.50000 > ankit-XPS-13-9350.localdomain.47256: Flags [.], seq 176584:183824, ack 208513, win 280, options [nop,nop,TS val 450899274 ecr 14941775], length 7240
15:29:11.546071 IP bob.localdomain.50000 > ankit-XPS-13-9350.localdomain.47256: Flags [.], seq 183824:191064, ack 208513, win 280, options [nop,nop,TS val 450899274 ecr 14941775], length 7240
15:29:11.583654 IP ankit-XPS-13-9350.localdomain.47256 > bob.localdomain.50000: Flags [.], ack 191064, win 41008, options [nop,nop,TS val 14941785 ecr 450899274], length 0
15:29:11.583662 IP bob.localdomain.50000 > ankit-XPS-13-9350.localdomain.47256: Flags [P.], seq 191064:193200, ack 208513, win 280, options [nop,nop,TS val 450899283 ecr 14941785], length 2136
15:29:11.595954 IP bob.localdomain.50000 > ankit-XPS-13-9350.localdomain.47256: Flags [P.], seq 192512:193200, ack 208513, win 280, options [nop,nop,TS val 450899287 ecr 14941785], length 688
15:29:11.596858 IP ankit-XPS-13-9350.localdomain.47256 > bob.localdomain.50000: Flags [.], ack 193200, win 40624, options [nop,nop,TS val 14941788 ecr 450899283,nop,nop,sack 1 {192512:193200}], length 0
15:29:11.670277 IP bob.localdomain.50000 > ankit-XPS-13-9350.localdomain.47256: Flags [.], ack 208513, win 10448, options [nop,nop,TS val 450899305 ecr 14941788], length 0
15:29:11.671304 IP ankit-XPS-13-9350.localdomain.47256 > bob.localdomain.50000: Flags [.], seq 208513:211409, ack 193200, win 40624, options [nop,nop,TS val 14941806 ecr 450899305], length 2896
15:29:11.671371 IP ankit-XPS-13-9350.localdomain.47256 > bob.localdomain.50000: Flags [.], seq 211409:212857, ack 193200, win 40624, options [nop,nop,TS val 14941806 ecr 450899305], length 1448
15:29:11.671493 IP ankit-XPS-13-9350.localdomain.47256 > bob.localdomain.50000: Flags [.], seq 212857:214305, ack 193200, win 40624, options [nop,nop,TS val 14941806 ecr 450899305], length 1448
15:29:11.671618 IP ankit-XPS-13-9350.localdomain.47256 > bob.localdomain.50000: Flags [.], seq 214305:215753, ack 193200, win 40624, options [nop,nop,TS val 14941806 ecr 450899305], length 1448
15:29:11.671708 IP ankit-XPS-13-9350.localdomain.47256 > bob.localdomain.50000: Flags [.], seq 215753:217201, ack 193200, win 40624, options [nop,nop,TS val 14941806 ecr 450899305], length 1448
15:29:11.671863 IP ankit-XPS-13-9350.localdomain.47256 > bob.localdomain.50000: Flags [.], seq 217201:218649, ack 193200, win 40624, options [nop,nop,TS val 14941806 ecr 450899305], length 1448
15:29:11.671989 IP ankit-XPS-13-9350.localdomain.47256 > bob.localdomain.50000: Flags [.], seq 218649:220097, ack 193200, win 40624, options [nop,nop,TS val 14941806 ecr 450899305], length 1448
15:29:11.672111 IP ankit-XPS-13-9350.localdomain.47256 > bob.localdomain.50000: Flags [.], seq 220097:221545, ack 193200, win 40624, options [nop,nop,TS val 14941806 ecr 450899305], length 1448
15:29:11.672220 IP ankit-XPS-13-9350.localdomain.47256 > bob.localdomain.50000: Flags [.], seq 221545:222993, ack 193200, win 40624, options [nop,nop,TS val 14941806 ecr 450899305], length 1448
15:29:11.672358 IP ankit-XPS-13-9350.localdomain.47256 > bob.localdomain.50000: Flags [.], seq 222993:224441, ack 193200, win 40624, options [nop,nop,TS val 14941806 ecr 450899305], length 1448
15:29:11.672479 IP ankit-XPS-13-9350.localdomain.47256 > bob.localdomain.50000: Flags [.], seq 224441:225889, ack 193200, win 40624, options [nop,nop,TS val 14941806 ecr 450899305], length 1448
15:29:11.672604 IP ankit-XPS-13-9350.localdomain.47256 > bob.localdomain.50000: Flags [.], seq 225889:227337, ack 193200, win 40624, options [nop,nop,TS val 14941806 ecr 450899305], length 1448
15:29:11.672712 IP ankit-XPS-13-9350.localdomain.47256 > bob.localdomain.50000: Flags [.], seq 227337:228785, ack 193200, win 40624, options [nop,nop,TS val 14941806 ecr 450899305], length 1448
